date_raw,sender_name,text
17 weeks ago,Doris ***********,Watching from Riyadh
17 weeks ago,Rose ***********,Sir fully vaccinated namn puede na na cgro sana wala nga One health pass kami
17 weeks ago,Lilian ***********,Sir sna po my retirement program din po para sa amin
17 weeks ago,Erlin ***********,Watching you from SINGAPORE
17 weeks ago,Dumalaog ***********,Watching from muscat Oman
16 weeks ago,Elsa ***********,"Ito Po no. Ko ******* GOD Bless you and Happy Bless Sunday
Po sa inyo"
17 weeks ago,Emz ***********,Watching from dubai
17 weeks ago,Joy ***********,Sir yung dole akap po na hndi nka tanggap nuon d2 sa abroad.mkakatanggap prin po b pag uwi ng pinas.
17 weeks ago,Jodelyn ***********,Hi sir arnel im watching from damam ksa
17 weeks ago,Tessie ***********,"good evening po sir arnel,sir itatanong ko lang po kung pano po sana maka-avail ng scolarship para po sa anak ko graduating po cya ngayon ng grade 12 active owwa member po ako,salamat po"
17 weeks ago,Daisy ***********,Mag asawa kaming nsgbabayad ng owwa .walang pakinabang sa scholarship ma sinasabi nyo
17 weeks ago,Jenny ***********,hello po pls pwede gawan yung one health na same process nung una po tapos po yung pag process po ng contract verification dito po sa dubai
17 weeks ago,Monge ***********,Mahina po sound nnyo sir
17 weeks ago,Myrna ***********,Watching you from Bulgaria
17 weeks ago,Ana ***********,watching from Dubai
17 weeks ago,Wendellrimorin ***********,"Sir Arnel, pag nakatapos po ba ng 2yrs Ang isang ofw my makukuha po ba na pangkabuhayan"
17 weeks ago,Rosalina ***********,Watching from qatar
17 weeks ago,Jennifer ***********,"Gud pm sir arnel ktulad po s kso ng ate ko hind ny mttpos ang 2yrs uuwi po cy ng pinas ng dec 1yr lng po cy my mkukuh pob cy or my maitutulong b kyu s kny,nhihirpn po kc cl dun wl pong pgkain cl ang bumubili ky npilitn clng umuei"
17 weeks ago,Francisco ***********,Walang mahirap sa one health pass. Tamad lang sila mag filles
17 weeks ago,Isaiah ***********,watching from taiwan
17 weeks ago,Nerry ***********,Sir arnel pwede isasahin nyo n lng kng ano ang mga benefit ng owwa para maintindihan ng lahat specially s scholarship.
17 weeks ago,Melai ***********,Watching from taiwan
17 weeks ago,Liezl ***********,"Dapat po tinanggal nlang ang one health pass ..Lalo na mga ofw complete vaccine with boosters
na po"
17 weeks ago,Mezgo ***********,ok na sana ang complete vaccine bakit may one health pass pa.
17 weeks ago,John ***********,Sir arnel sana lahat magkaroon ang OFW/Seaman ng HMO para sa mga benefits ng aming pamilya at accredited po sana ng lahat ng hospitals
17 weeks ago,Leizel ***********,Watching from Kuwait
17 weeks ago,Norma ***********,Subrang hirap po kasi ng one health pass po may bar code at yong Qr code po.kapag di po nakapasok ang Qr code di ka makakapasok sa eroplano
17 weeks ago,Janice ***********,"Hello po sir Arnel
watching from taiwan"
17 weeks ago,Che ***********,"Congrats
sir arnel"
17 weeks ago,Mechell ***********,hi po sir Arnell
17 weeks ago,Jena ***********,Sir anu anu po requirements po s pg apply ng shoollarship po
17 weeks ago,Tongsam ***********,sir arnel kasi hindi po kami makauwi kasi my penalty po kami sana matulungan nyo po kaming lima matagal na kami dito sa shelter riyadh ksa
17 weeks ago,Avhic ***********,Sir ask lng po may makukuha po ba sa owwa o dole akap yung mga di pa nakakabalik sa hk last year lng po umuwe.ty and god bless po.
17 weeks ago,Gilmelyn ***********,"sir arniel,mhirp po kumuha ng cash assistance ofw po.bkit mhirp po kumuha ng scholarship pg ofw"
17 weeks ago,Rhiz ***********,Watching from hongkong
17 weeks ago,Susana ***********,Watching here from UAE
17 weeks ago,Ligaya ***********,Watching from Amman jordan
17 weeks ago,Ruvelyn ***********,"Watching from jeddah ksa,stay safe po sir arnel,gdblss po,"
17 weeks ago,Ruela ***********,Sir arnel sna wag nmn yng insurance dagdag gastos p
17 weeks ago,YL ***********,Watching from taiwan
17 weeks ago,Marjie ***********,Sir arnel pede po ba mkaavail ang family ng ofw sa free quarantine
17 weeks ago,Rosela ***********,Sir pwede naba ako mag paopera mayoma sa ofw hospital pampanga sa Dammam po ako galing umuwi po ako kc lumalaki tiyan ko.pagdating ko dto mayoma ang findings.thanks
17 weeks ago,Van ***********,Watching from kuwait
17 weeks ago,Bernadette ***********,Sir bka pede nyo po aq tulungan mkpg trabaho ulit
17 weeks ago,Zhinjean ***********,Sir paano po maka avail sa scholarship elang bisis na ako pumunta sa owwa doon sa iloilo antay daw 9yrs na akung ofw po
17 weeks ago,Levy ***********,Tanggapin nalang Yung one health pass
17 weeks ago,UmmieFhiyyah ***********,Ako nga 6yrs na kahit piso wala ako na tanggap ano man programa ng owwa.. di na rin ako aasa pa kase ho masakit ang umasa wala kna man aasahan
17 weeks ago,Federico ***********,"WATCHING FROM ITALY NEED ATTY KC GUSTO FORECLOSE SMDC HOUSING LOAN NAMIN, NAG REQUEST KAMI EXTENSION NG LOAN KC MAY PANDEMIC, UNTIL NOW AYAW SUMAGOT BANK, THANKS"
17 weeks ago,Biang ***********,sana sir yung one health pass balik sa dati po...thank you
17 weeks ago,Jheyjhey ***********,Watching from Jeddah ksa
17 weeks ago,Flores ***********,Sana po ay Alisin n nyo po ang one health pass matulungan nyo kame dto. KC hirap po kame s ohp n to
17 weeks ago,Beth ***********,Watching from buraydah saudi
17 weeks ago,Zitro ***********,Scholarship ng OWWA.para sa mga anak ng OFWs esp sa mga single parents
17 weeks ago,Ronaldo ***********,Watching from israel
17 weeks ago,Missdindi ***********,Nanawagan pOH lahat ng OFW . Na tanggalin Ang one health pass . . Nhirapan dw pOH ung iba .mag register at pagod na Sa byahe. Dapat deretso uwi na pOH
17 weeks ago,Tseong ***********,Magandang araw po mga Sir and Mam po dyn sa owwa tanong lng po magkakaroon po ba ng Amnesty sa buong KSA pra po sa mga OFW na may suliranin po sa mga iqama at mga hurob po? Salamat po Kung sino man tutugon sken katanungan God Bless.
17 weeks ago,Odessa ***********,Sir kilan namin makuha ang covid assistance namin nag positive po ako sa covid dito sa singapore still waiting po ng assistance galing sa owwa
17 weeks ago,Aries ***********,sir un oec dpt accrpt po kht wla appointment
17 weeks ago,Maricel ***********,Sir tanggalin nyo ang one health pass nahirapan kami hindi lahat nang ofw marunong sa cp
17 weeks ago,Elena ***********,Watching from kuwait
17 weeks ago,Lorena ***********,Nko po 4 months ka pa tapos uuwi kana kabayan
17 weeks ago,Vikki ***********,"How to apply owwa loans, phirapan n nman , ung tipong prang ayaw kmi phiramin"
17 weeks ago,Elvie ***********,Watching from Kuwait
17 weeks ago,Solo ***********,Good evening sir arnel dito po ba kau KSA
17 weeks ago,Jackie ***********,Watching from Saudi Arabia jeddah good evening po sir Arniel idolize po kta
17 weeks ago,Cherry ***********,Sana Alisin na po yan one health pass please watching from Kuala Lumpur Malaysia
17 weeks ago,Imelda ***********,"Sir, Arnel paano mg avail po ng scholars to my daugther mg college na 2023-24"
17 weeks ago,Jhovie ***********,Watching from taiwan
17 weeks ago,Bheth ***********,Hello sir good evening Watching from rijadh
17 weeks ago,Joy ***********,Sana po matangal n yan ang one health pass
17 weeks ago,Shirley ***********,Hi Sir Arnel naabutan ako ng lockdown dto last march 2020 d na ako nka balik sa Malaysia .. may job order kaya na legit po
17 weeks ago,Marita ***********,Sir balak ko npo sana mag exit Kasi Marami npo sumasakit sakin gusto kopo sana Maka kuha Ng scholar para sa anak ko 2nd year College p lng Po anak Kong panganay single parent Po ako
17 weeks ago,Rosemalyn ***********,Hello sir Arnel watching from kuwait
17 weeks ago,瑪瑞安 ***********,Watching from taiwan
17 weeks ago,Gabby ***********,Watching here in qatar
17 weeks ago,Zillin ***********,Gd eve po sir arnel watching from singapore
17 weeks ago,Arbaiya ***********,Salam sir paano Po mag Aply na scholeship Ang mg anak NG Ofw visa 20 ako NASA Kuwait Po ako
17 weeks ago,Gong ***********,Watching from Hong Kong
17 weeks ago,Kimberlyn ***********,Lht sir tangglin tlga one health pass sir.. please nmn
15 weeks ago,Zubie ***********,sir sana masagot m tanong ko para s polgod kasi d2 s Oman pag nasa bahay ka dw mg work wla dw makoha n porgod nka 22 years n ako s isang amo lng sana po sir masagot m sir
17 weeks ago,Josephine ***********,Whatching from kuwait
17 weeks ago,Jenelyn ***********,"Goodmorning po sir watching from hongkong,Sana po sa covid assistance maibigay nman po,salamat po ,godbless"
17 weeks ago,Mavelyn ***********,I'm watching from India
17 weeks ago,Ghie ***********,Sir Arnel sana po gobyerno nlng o imandatory ang employer ba magbgay o magbayad ng graduity or imdemnity para kpg uwi namin un nlng ang maibgay nyo kc madami employer na hindi sumusunod
17 weeks ago,Maricel ***********,Watching from Hong
17 weeks ago,Anabelle ***********,Watching from Dubai
17 weeks ago,Leopoldo ***********,Sir dito ako sa region 4A sa Brgy. Bitin Bay Laguna Yong apply ko ng OWWA Profs last year pa apply wala pang feedback ano mang tulong magawa nyo ay labis Kong pag pasalamat
17 weeks ago,Aj ***********,Watching from qatar
17 weeks ago,Analiza ***********,Sir.. Arnel single mother po Ako..magdadalawa n po Yung anak ko sa kolihiyo paano po b mkakuha Ng scholarship maliit lng po Ang sahod Ko... Sana po mpansin nio po ako..
17 weeks ago,Castor ***********,Watching from Qatar
17 weeks ago,Liza ***********,"Congrats
kya arnel mabuhy po kyo"
17 weeks ago,Lydia ***********,Watching from indonasia
17 weeks ago,Ana ***********,"Sir ingt lagi ah, alagaan nyo po sarili nyo Marni p po kyo mtutulungan"
17 weeks ago,えまやのし ***********,Watching po from UAE
17 weeks ago,Hernandez ***********,Good evening po Sir matagal na po ako sa hk Wala pa po ako natanggap sana po makatanggap Naman po ako
17 weeks ago,Geraldyn ***********,May financial assistance kaya ako ser pag uwe sa davao mag paopera ako expire na contrata ko last November 21'2012'hanggan ngayon nandito pa po ako sa oman
17 weeks ago,Magie ***********,Watching from Taiwan
17 weeks ago,Normina ***********,Hwello po sir from ksA
17 weeks ago,Siele ***********,Sana po sir mawala na po iyong one health pass
17 weeks ago,Maricel ***********,Watching from jongkong
17 weeks ago,Lenriz ***********,Sir please request ng lahat ng OFW tanggalin nlang one health pass pahirap po sa manga tulad naming OFW pauwi
17 weeks ago,Aves ***********,Sir..arnel..sana po ma lutas nyo about sa onehealth pass...
17 weeks ago,Anyah ***********,Sir ung pong pag ibig need po b talaga n monthly n kmi maghulog pra daw po sa oec nmin.. pano po kaming maraming no pay leave kada buwan mapunta n lng sa paghuhulog sa pag ibig
17 weeks ago,Mariesa ***********,Sir gsto ko po sana mag renew ng owwa membership ko pero hirap kumuha ng appointment sir pls pa help sana po thank u ...dubai po
17 weeks ago,Achel ***********,pashout out po sa mga taga saudi arabia n 4 n buwan ng walang sahod
17 weeks ago,Madhel ***********,Watching here in Riyadh
17 weeks ago,Mahje ***********,Sir sana pansinin nyo nMn kming ofw na hiling lng nmin sana tanggalin na Ng BOQ ung one health pass..
17 weeks ago,Marjorie ***********,"Sir pwedi po kaya ako makapag avail nong scholarship kung ako po mismo Ang mag aaral po??gusto ko po kasi sanang mag aral sa kolehiyo,,ofw from Jordan po"
17 weeks ago,Keiar ***********,Sir paanu po makaavail nang scholar sa mga anak namin..thank you po
17 weeks ago,Sherwin ***********,Sir wala prin po confirmation galing sa dole akap un application k po isang taon n po waiting prin po hanggang
17 weeks ago,Echu ***********,Yes sir ease program naka avail po ako nuan
17 weeks ago,Manuel ***********,Sir arnel ung 7days quarantine pabalik ng hongkong matanggal n rn pra makapag bakasyon n kmi mga ofw dito sa hongkong
17 weeks ago,Aries ***********,"Sir hirap po kmi kuha ng OEC sana kht wla appointment accommodate nman,,att mag assist po para maliwanagan kmi"
17 weeks ago,Tesorero ***********,"Congratulations
po"
17 weeks ago,Nylrem ***********,Watching from Dubai
17 weeks ago,Ina ***********,Dapat talaga kung mag aabroad buo ang loob. Hindi basta basta ang pag abroad.
17 weeks ago,Sacrifice ***********,Sis gusto ko na uuwi tulonfan po ninyo ako pag registered sa one health pass kc hnd ko alam kc wla akong pinag aralan
17 weeks ago,Mhel ***********,Hello po sir Arnel goodevening po
17 weeks ago,Norlie ***********,Watching from Riyadh
17 weeks ago,Reden ***********,Sir arnel balak ko na po sana mag for good sa pinas may privilege po ba ako makukuha 8yrs po ako dito sa saudi qt pde po mag aral gamit ang owwa benifits
17 weeks ago,Rhiz ***********,"Sana ipakita nlng sa Airport yong ofw ecard nalng namin mga ofw,, wag nlng pahirapan po"
17 weeks ago,Arlene ***********,"ofw insurance mandatory,anu po ba ang benifits nmin doon?"
17 weeks ago,Regina ***********,Watching from Singapore
17 weeks ago,Florizza ***********,Sir bkit po.ung inaplayan nmin assistamce n bpbh ay wala man lng po update samin ang tagal n po wala man lng po update
17 weeks ago,Ashley ***********,Watching here from Kuwait
17 weeks ago,Zyyaj ***********,SIR ARNEL BAKA NAMAN PO PDE MAPABILIS YUNG SA WELFARE ASSISTANCE PROGRAM OH MEDPLUS PO PRA MAGAMIT NAMAN YUNG PO YUNG PERA MATAGAL DAW PO MG EVALUATE YUNG MGA DOCTOR NG OWWA PRA SA APPROVAL NG CHEKE
17 weeks ago,艾曼努 ***********,"Sir yong mga ng positive po ba sa COVID my makukuha po ba sa OWWA? pag ng positive kasi No Work no Pay 14 days wala Sahod, ,"
17 weeks ago,Ramlyne ***********,Sir Alison nlang po ang one health pass mahirap
17 weeks ago,AbiGail ***********,Salute to you sir Arnel
17 weeks ago,Tongsam ***********,sir tulungan ninyo po kami ditong lima sa shelter riyadh makauwi po sana mapansin ninyo kami dito
17 weeks ago,Mhal ***********,"Good evening sir Arnel, mag final exit na po sa dati kong amo, kung mag reapply po ng saudi,hindi na po ba ako makakabalik dahil ban? Consider as new applicant na po ba ako nun?"
17 weeks ago,Edelyn ***********,"Ang prblema nmin Ng mga OFW at Ang one health pass Nayan,,,plzz nman pki balik nlng yong dating pagregister Ng OHP na yan plzzz"
17 weeks ago,Mary ***********,"Paanu po mag upply schools po, mag 8yrs n po ako sa saudi"
17 weeks ago,Tyrone ***********,Sir arnel ask ko lng po Kung may makukuha po ba ako na assistance sa owwa ung mga seaferer sir at Kung mayron man anu po yon sir arnel
17 weeks ago,Ailen ***********,Watching from Taiwan
17 weeks ago,Helen ***********,Gud evenings po sir arnel
17 weeks ago,Geny ***********,Gud evening po sir sana po tanggalin na lmg po Ang one health pass..pls
17 weeks ago,Imee ***********,"Hello po Sir Arnel, magandang gabi po,, shout out po from Yuenlong..God bless po,"
17 weeks ago,Jane ***********,Mahina po sir..watching from singapore
17 weeks ago,Falyjpbijc ***********,Watching here in DUBAI. evening sir Arnel
17 weeks ago,Jason ***********,Hi sir arnel yung tungkol ho sa one health pass.meron pa po bang bar code vs Qr code .nahihirapan na kasi ang iba e
17 weeks ago,Fliroas ***********,"Shout out po s gumawa ng OHP
pwd b ung mas mabilisan lang dapat ang gawin nyong system"
17 weeks ago,Bernadette ***********,Gusto q po mkpg trabaho ulit sa UAE Sir...patay npo Nanay at Tatay q ang hirap po ng wlng trabaho...
17 weeks ago,Vilma ***********,ano po ba makukuha ng isang ofw ng tulong sa owwa gsto konang mgforgood sana matulungan nyo ako makakuha ng kaunting tulong png neg9syo
17 weeks ago,Angeline ***********,Sir ask kopo ung sa dole akap approved napo last September papo ako nagapply then until now wala padin po sna masagot nio po ako
17 weeks ago,Harvee ***********,"sir sana po mtulungn nio po ako pano po mkukuha yung 2 buwan na sahod ko pnauwi po ako kahit piso wala po ako nauwi gling po ako saudi pmunta po,ako,owwa di nmn po ako,inasikso sana po mpansin po ako salamat"
17 weeks ago,Chila ***********,Sir arnel paano po maka avail nh scholar anh anak dalawang college po sana matagal na po akonh ofw sa kuwait
17 weeks ago,Maricel ***********,Puro lng po program wala pong aksyon
17 weeks ago,Cel ***********,Dapat po ibalik n lng po Yung oasis at Yung red cross or traze app mas madali p po mag sign dun kesa sa one heatlh pass po
17 weeks ago,Anne ***********,"Sir paano Yong dole akap na 10,000 na approved na ako pero tagal mgdating.. ngayon nka blik na ako sa ibng bnsa paano ko mkuha incase na dumating pwede mg received ang anak ko?"
17 weeks ago,Mj ***********,Congratulations
17 weeks ago,Weis ***********,Owwa dto Taiwan d man lng mag respond sa inquiries namin
17 weeks ago,Alain ***********,Gud eve Po....ask lng Po mag 1yr.n ndi p n release ung akap oasis
17 weeks ago,Indaylyn ***********,Sir sna tanggaalin po ang 1 health pass po
17 weeks ago,Ana ***********,Sir scholarship pwede po b online Mgapply po PRA s mga ank q
17 weeks ago,Bong ***********,Dole akap po sir sana ma release na po more than a year na po ako nag apply hanggang ngayon wala parin po. Complete naman ang requirements ko.
17 weeks ago,Grace ***********,D2 po sa UAE sir ang hirap po mkakuha ng slot for verification contract lahat po full eh paano namn po kami na uuwi ng july sir
17 weeks ago,Nalem ***********,Pakiusap po namin mga ofw alisin na ang one health pass
17 weeks ago,Crazii ***********,"Madaling makaalis pa abroad,pahirapan makakuha ng requirements pauwe ng pinas mahaba n pila may limit p"
17 weeks ago,Jonna ***********,"Sr sana po matulungan nyo kami maiiuwi ang kapatid namin nasa Abu Dhabi,ngaun po nasa morgue sya mag 4 na buwan po sya dun.nde pa nmin maiuwi ang knyang katawan"
17 weeks ago,Lorna ***********,Hello sir pwd po wala nalang health pass pcr negative test nalang po lalo kaming nahirapan tapos wala pang wifi
17 weeks ago,Enahj ***********,Pwede po matulungan ang kapatid ko na ofw nsa ospital po kz anak nya
17 weeks ago,Lina ***********,Minsan po mahirap po pumasok sa site nila sir ng healt pass lalo po dapat 48 hrs before flight minsan nd po kc maka pasok sa site
17 weeks ago,Nancy ***********,Dinga po maibigay ang dole akap po nmin r4a gang ngayon nga nga..
17 weeks ago,Habibi ***********,Watching frm riyadh
17 weeks ago,Ramosraul ***********,DITO PO KAMI SA ITALY 3 KAMING NAG KASAKIT NA COVID 1 BUWAN PO KAMING NAKAKULONG PLS IDOL PAKI SAGOT PO PLSSSS KONG BAKIT HINDI NA KAMI BINIGYAN
17 weeks ago,Marilou ***********,Whatching from alqassim
17 weeks ago,Anrhym ***********,"Sir ung tnung k po sana mapancn,,,8yrs nko sa amo ask k panu ipaliwanag sknla ung indemnity kc kht anung slta ko sknla sgt nla wlaa dw ganun...panu po ba sir arnel ,,riyadh saudi po ako"
17 weeks ago,Jessa ***********,Watching from kuwait city
17 weeks ago,Molina ***********,Watching from saudi arabia sir ako po after 2yrs gusto q n po mag for good s pilipinas mabigyan nyo po sna aq ng png bussines salamat po.
17 weeks ago,Marvan ***********,"umuwi po kme oct 2020 at approvd ba ung dole akap na ayuda hanganga ngayon wala adon po. mavan salas, mary Marvan Aguilar Salas"
17 weeks ago,Beth ***********,Bat po hanggang ngyn hndi pdin po na re-release ang owwa project ease
17 weeks ago,Christine ***********,Sir good eve sana maka avail din mga anak k ng scholarship tatlo po kc magkokolohiyo k salamat po
17 weeks ago,Yoo ***********,Watching for riyadh BK
17 weeks ago,Junaliza ***********,watching from.hk po
17 weeks ago,Gina ***********,Sir Arnel paki alis nm po ung one health pass nahirapan ako
17 weeks ago,Ireneta ***********,"Hi sir Arnel, paano po mag register para sa scollar ng anak ko,,, dito po ako sa Tabuk, Saudi Arabia
sir gandang araw po sa inyong lahat."
17 weeks ago,Gin ***********,"Good evening sir isa po ako OFW here in abudhabi , gusto ko manghingi ng tulong po sa OWWA pra sakin nanay pambili po ng gamot nia sir Arnel .."
17 weeks ago,Datu ***********,Naguguluhan po kc kami bakit may tawakalna may one health pass may red cross pa may swab test pa.
17 weeks ago,Nenita ***********,Congratulations poh
17 weeks ago,Bautista ***********,Im watching from dubia
17 weeks ago,Myrna ***********,"Sir baka namn po tanggalin na po yong one health pass pahirap lang po yan sa mga ofw na pauwi,"
17 weeks ago,Albert ***********,sir sana po mabigayang pansin yung claims namin na naiwan namin sa Azmeel.. alam po yan sir nila mr. Nasser Labat
17 weeks ago,Wendy ***********,ok 5 kmi.from milan
17 weeks ago,كالو ***********,Alhamdulillah ung anak ko
17 weeks ago,Jane ***********,Hello po sir arnel
17 weeks ago,Mails ***********,mga ofw dito sa dubai bakit po napa hirap kumuha ng oec
17 weeks ago,Robeil ***********,Mahina unh sound
17 weeks ago,Jerlyn ***********,Good eves sir
17 weeks ago,Pakskeezz ***********,Bakit po wala parin ung DOLE AKAP namin 1yr na po nakalipas.sana makatanggap na kami.
17 weeks ago,Liza ***********,Sir may tanong lang po alko papano. Po b yung owwa scholar para s single mother thank you po
17 weeks ago,Cleofe ***********,Nag apply na kami nang scholarship may binigay na kami requirements lahat at wala pang reply
17 weeks ago,Kirby ***********,Sir ung TABANG baka po pwede ma.grant n po ulit. Thanks
17 weeks ago,Yankumi ***********,sir arnel pki follow sna po ako ng dole akap sa wla pdin po kz..
17 weeks ago,Cjblake ***********,"Sir,ano po ba mga requirements pra mapa check up ung papa ko. Ofw po ako dto sa uae"
17 weeks ago,Ana ***********,"Sir saan po ung hospital ng mga ofw po, ng nkpgpchecknup po PG uwi sakit po s likod s ktrtrbho po at lumalabo ang mata s indomi pgkain kulang s nutrients"
17 weeks ago,Yenruj ***********,Sir good morning po dyqn s pinas
17 weeks ago,Emily ***********,Tanggalin din ang one health pass nagpapahirap sa mga ofw
17 weeks ago,Melody ***********,Hello sir apply ko anak ko mag schoolar OFW po ako dto sa Dubai 8 taon na po ako dto Hindi ko na po kaya marami na po ako nararamdaman sakit sa katawan nag titiis lng po ako salamat po
17 weeks ago,Rose ***********,Sir mahina parin po boses ...watching from RIYADH po
17 weeks ago,Elexis ***********,"Sir paano naman po yung ina at tita ko, binugbog 0ero walang ginawa sakanila dimanlang pina!edical di sila makauwi dahil kelangan nila magbayad ng1kd each."
17 weeks ago,Rosela ***********,Sir pwede ba ako magpa opera nang mayoma sa ofw hospital .ofw from Dammam umuwi po ako kc lumalaki ang aking tiyan findings mayoma.thanks
17 weeks ago,Don ***********,Watching from ipatupad head quarters po
17 weeks ago,Edralyn ***********,Sir tanung lng paanu po transfer sa akn ung tawakalna..kz nakaregister po sa amoq.
17 weeks ago,Elexis ***********,"Hi sir arnel, yung mommy ko po at tita ay binugbog po sa kuwait yet ang agency po roon ay walang ginagawa."
17 weeks ago,Yeshi ***********,sir arnel ung mga ofw po na 3taon Napo na nakatengga Ang kaso sa Saudi Arabia Polo dahil sa Hindi pagbibigay ng sahod baka po may maitulong din po kau..2019 pa po ng mare patriated Ang 292 na ofw po.
17 weeks ago,Jackie ***********,Sir arnel pakitangal na ang one health pass watching from kuwait
17 weeks ago,Russell ***********,SIR ARNEL SENSYA NA LATE NAKA OPEN.PAULIT PO NUNG PRA SA OFW SEAFARERS ANONG PEDENG MAHINGENG TULONG...
17 weeks ago,Miles ***********,Sir Pano po kng NSA pinas na po kng d po Ng bigay yng amo Ng endemnity pede pa po ba Yun makuha Pano po ba?.my MGA amo po KC tlga ayaw mg bigay slamat po ..
17 weeks ago,Fred ***********,"Good evening sir Arnel,kelan po kaya release ng Dole Akap,1yr ago na po"
17 weeks ago,Crazii ***********,"Tulungan nio n lang kmeng alisin ang 1 health pass,sir Arnel"
17 weeks ago,Rubia ***********,Late na ang kunyang sa dami ng trabaho magandang gabi po
17 weeks ago,Jocelyn ***********,Watching frm Abudhabi
17 weeks ago,Agnes ***********,Watching from singapore
16 weeks ago,Esmeraldo ***********,Good day to all.
17 weeks ago,Ran ***********,Sir Isa sa mga mandatory requirements ngaun ay Ang insurance bago ka makkuha Ng OEC.
17 weeks ago,Datu ***********,Sir Arnel unfair kc ang owwa pgmuslim ka hindi inaaksyunan pinapalik balik ako tos wala nman maasahan na tulong. Kaya Sana hindi unfair
17 weeks ago,Chinarose ***********,sir sna poh mka pasok anak q s scholarship program single parent poh aq..region 5 poh..
17 weeks ago,Santos ***********,"Sana po makauwi kahit Wala mga bakuna,tapos na kontrata last year pa.....nasa Riyadh po...Ang problema Sabi ni amo d daw makapasok sa airport Kasi Wala bakuna"
17 weeks ago,Elexis ***********,Naway mapansin nyo po sana ang paghingi namin ng tulong dahil sa pang aagrabyado ng amo ng magulang at tita ko sa kuwait.
17 weeks ago,Ana ***********,Sna po madming Live Kya po iba po dmi pong nghingi ng tulong
17 weeks ago,Teresita ***********,Kaya nga sir yan ang problema nmin mga ofw sir un ohp. Sana poh tangalin n yan sir
17 weeks ago,Dugtong ***********,Uupo na mahal na presidents #BBMFORPRESIDENT2022 UNTILL NOW NFI PRIN BININIGAY ANG ASSISTANCE PROGRAM NG DOLEAKAP HAY NSKU ANU NA NANGYARE
17 weeks ago,Lillian ***********,Libreng pabahay sir arnell Pra sa mga OFw like me. Godbless po from Doha Qatar
17 weeks ago,Snips ***********,Sir ano po mga Pwede ng makuha ng mga pamilya namin sa mga active members at kasalukuyang nasa abroad pa
17 weeks ago,Janile ***********,I'm watching UAE
17 weeks ago,Madonna ***********,Watching here in Jeddah sir Arnel Ignacio
17 weeks ago,Bdict ***********,Watching from saudi sir paki tignan mo yong serbisyo ng one health pass sa amin mga ofw
17 weeks ago,Sobremisana ***********,Sir tanung Lang po ung amo ko AKO mgbbyad Ng ticket ko pinababalik AKO tpos Ako mgbbyad Ng ticket ko my kaltas na agd s shod ko
17 weeks ago,Lido ***********,Sir Arnel kailan po mag start sa scholarship para mag submit nag requirements..
17 weeks ago,Makulit ***********,Sana nmn po kht na minor pa lng ung Bata bsta may guardian Ng kamag o auntie pinapayagan.hnd ung pahirapan
17 weeks ago,Mel ***********,naku sir sana pansin mo ung problem na kuha na oec sana tangal na lahat hasol lang pag uwi namin ok na bayad nalang owwa dami pa hingi papel uwi naalng
