date_raw,sender_name,text
17 weeks ago,Nora ***********,Hi sir arnel.gud eve po... From. Lebanon
17 weeks ago,Amethyst ***********,Hello po sir...paano po mk avail ng scholarship...
17 weeks ago,মনে ***********,Sir paki tanggal namn ninyo ung one health pass
17 weeks ago,Wuzzey ***********,Para anu pa ba ang one health pass sir
17 weeks ago,Lani ***********,Napakahirap naman po mag avail napakadami ng requirements
17 weeks ago,Frederick ***********,Kung talagang gusto nyo pong makatulong sa am8n baka pweding ala ng one health pass na yan..
12 weeks ago,Ann ***********,"Sana mabasa nio ung panawagan ko po
salamat po"
17 weeks ago,Nehaal ***********,Sir paano po maka kuha ng mga binifets sa OWWA for good napo ako more than 10 yers wala rin pong ipon
17 weeks ago,ۦۦ ***********,CASH ASSISTANCE SIRRRR!!
17 weeks ago,EdMrn ***********,Sir paano ba ung sabi mo 5person para pang kabuhayan po
17 weeks ago,Anthony ***********,naaprove nman po kasi nacompky nman lahat ng requirements
17 weeks ago,Aj ***********,Pwde po un ilipat ng agency ako po naka 4times ako lipat pero ok lang mahalaga hnd pinapabayaan ng agency
17 weeks ago,Arlyn ***********,Good evening sir arnel ng aply na po ako dati sa owwa scholarship ng anak ko pwd pb mkkuha sya owwa scholarship
17 weeks ago,Maru ***********,"SIR ARNEL, ANO PO UNG INSURANCE NA BABAYARAN NG MGA OFW??"
17 weeks ago,来衣领 ***********,Sir.. Pano po mag apply ng scholarship pra po sa mg college n active member po ng owwa.. Thank you
17 weeks ago,Patrick ***********,"Direktang aksyon nalang po dito sa region 4a about sa dole akap, may mga ofw taga region 4a hindi alam naka live kayo at hindi alam mag email, mahigit 1 year na nag aantay salamat po"
17 weeks ago,Honey ***********,"Sir,arnel bakit po ganun ang owwa d makatulong sa mga katulad ko nwalan ng work last year sa hongkong"
17 weeks ago,Gladys ***********,Maayos naman po ang one health pass. Bago po kasi Kaya Akala nila mahirap. Nakaka Buti Ito para sa safety ng nakakarami
17 weeks ago,Edzel ***********,Sa dole akap po ba..may pag asa pa po ba ibigay..maraming salamat pp
17 weeks ago,Chila ***********,Member naman po ako ng owwa 15 years napo akong ofw
17 weeks ago,Jennifer ***********,Gndang gbi pinas watching from riyadh sir arnel...
17 weeks ago,Aj ***********,Pwde po ba mag apply ng schoolar un pang 3yrs college po
17 weeks ago,Vhie ***********,Tiaga tiaga pag may time kabayan an dyn kana
17 weeks ago,Cory ***********,Musta po sir arnel.watching from belgium
17 weeks ago,Pilyang ***********,tama po mahirap daw maka pasok lalo na mahina ang net dapat walain na yan
17 weeks ago,Ibay ***********,Sir Arnel paano po maipapsok ko ng scholar yung anakk ko dto po aq now sa Riyadh Saudi Arabia
17 weeks ago,Deloyola ***********,saudi alkhobar watching sir arnel my problema ako
17 weeks ago,Kyle ***********,May makukuha po 24 years straigth sa isang amo
17 weeks ago,Jasmin ***********,Sir tanong ko lang pag umuwe ng pinas ngayun galing kuwait need pa ba mag signed ng one health past?
17 weeks ago,Bee ***********,Magandang gabi Po...tanong ko lang Po Yung sa owwa-dole akap program start na Po ba Ang release sa NCR? Maraming salamat Po sa pagsagot...God bless you Po...
17 weeks ago,Marilou ***********,"Gud evening sir Arnel..Ofw po from abu dhabi,Sir Arnel paano po mgapply ng scholarship para sa,anak q..grade 12 n xa sa June sir.."
17 weeks ago,سان ***********,Sir paano po kung hindi pa vaccinated ano po requirements po...
17 weeks ago,Bernadette ***********,Ang tagal q po ng work sa UAE nauwe lng po sa wla
16 weeks ago,Radzma ***********,Papaano po maka avail ng hanapbuhay assistance
17 weeks ago,Eun ***********,Hello sir ako po need help nwala po ako kanina kasi nawala yung internet connection
17 weeks ago,نيلز ***********,Sir Arnel panu po ung d abot ng 600usd ang sahod hindi mka avail sa scholarship
15 weeks ago,Alduena ***********,Watching here in Kuwait
17 weeks ago,Nerry ***********,Sir paano po makakuha ng scholarship s owwa.
16 weeks ago,Lolita ***********,sir paano po mang pagamot sa ofw ospital may anak ako sa china
17 weeks ago,Marissa ***********,Watching from Bahrain
17 weeks ago,Ebony ***********,"Good eve po, yung owwa ko hindi updated pero nagbayad ako sa embassy bago makakuha ng oec pero hindi nila inupdate"
17 weeks ago,Dabbie ***********,Halos pasigaw kn Sir pero ang hina ng dating
17 weeks ago,Shibayshan ***********,Sir One Health pass remove n po
17 weeks ago,Farah ***********,Hopefully nga po ma discuss mo po sa BoQ ang concerned ng mga ofw.
17 weeks ago,Cva ***********,Sir Arnel may i ask if free rin pa po makauwi sa province ang Ofw for 30yrs..but since pandemic po 2020 na stuck up po dito sa Manila (LSI) daHil d na PO natoloY ang alis nawalan na po ng trabaho.
17 weeks ago,Bautista ***********,Bka po pwd magawan nio ng praan n jan ko n lng po mbyaran 16 years n po aq sa ibayo dgat ngyn lng po hnd nkabyad
17 weeks ago,Joefritz ***********,"Good evening po sir, paano po mkakuha ng OFW scholarship pra s mga anak?"
17 weeks ago,Materese ***********,Pano po yun member ng owwa na d na rerenew nabbaliwa yun mga binabayd namn
17 weeks ago,Lorena ***********,Nko po kabayan balik ka nag Ponta Jan kong hindi naman pala boO loob mo
17 weeks ago,Shermahal ***********,Sir patulong nman kc mnsan walang time na pag pauwe na ang mga ofw
17 weeks ago,Miss ***********,kakabayad ko lng sa owwa sir ng ask aq sa owwa d2 sa Taiwan meco sa Taipei Sav 18 years old pababa lng dw pede mag avail
17 weeks ago,Don ***********,"hi po, sana po ma ayos na nyo ang apps sa mismo para po mapa dali ang pag kuha ng mga docs"
17 weeks ago,Najeeb ***********,Pano po ba mag apply ng hanap buhay assistant
17 weeks ago,Jonah ***********,Sana wala na health pass at magkaron sana ng mandatory na indemnity ang lahat ng household workers sa middle east...
17 weeks ago,Almenteros ***********,Sir ask kulang po Anu po no ng polo owwa
17 weeks ago,Shirly ***********,Sir bakit poh sa calamity fund sa odette need pa ilista at noong nagpalista kami di naman kami nilista
17 weeks ago,Mean ***********,Sir ask ko lng po pag po matagal ng hindi nag aabrod ehh isa p rin po b n member ng overseas worker.
17 weeks ago,Dio ***********,Sir Arnel may chance po bang alisin nlng ang OEC lalo pa kung babalik din lng same employer. Sana maging applicable nlng sa ofw's if bago ang employer nila.
17 weeks ago,Serrano ***********,Sir gusto ko na po umuwi ay repatriation po ba
17 weeks ago,Gian ***********,watching from italy
17 weeks ago,Aiko ***********,"Bakit ang REGION 7,bakit walang budget sa DOLE AKAP.repatrated ofw po ako."
17 weeks ago,Dhex ***********,"Hello Sir Arnel bka naman maibigay na yng aming doleakap sir., tagal na wla pa po eh"
17 weeks ago,Mercy ***********,"Sir arnel,,gusto ko pong malaman Kong panu makikita na reactive na yung owwa ko ,,ng bayad na po anak ko sa pinas ,,for membership"
17 weeks ago,Teresita ***********,Watching from kuwait hillo po sir may itatanonong lang po ako paano pp mascholar un anako sa collage salamat po sana mapansin mo to message ko mga sir and ma'am
17 weeks ago,Mari ***********,Anjan na po c sir juan.... Mas maige po kung ipapasok nyo dto sir pra malinaw
17 weeks ago,Bhusty ***********,Im from jeddah po sir arnel
17 weeks ago,Maribel ***********,mhina po angsound
17 weeks ago,Beyb ***********,Pano po ba mag apply ng scholarship sa OWWA
17 weeks ago,Maria ***********,homesick lng yn sir
17 weeks ago,Aim ***********,Sana lahat ng ofw tulungan lalo na yong matino
17 weeks ago,Nna ***********,Hi sir ask lang po paano po makakuha ng scholarship po
17 weeks ago,Agnes ***********,"Sir, ano po mga requirements mag apply ng scholarship para sa Owwa kasi po mag ka college na po anak ko ngayong taon. Sana mka pasok sya sa scholarship."
17 weeks ago,Elexis ***********,"nag medsage po ako rito, and sinemd ko po lahat drtails kaso dinyo po sila makaka usap for now dahil di alam ng agency na nakaka online po sila."
17 weeks ago,Miss ***********,scholarship sir kc gus2 ko pg aaralin kpated ko kaso hndi na pede ang edad
17 weeks ago,Lina ***********,Tanggalin din ang insurance bago kumuha ng oec paraan saan nanaman yan dagdag requirements
17 weeks ago,Ako ***********,Mandatory na po ba ung pag babayad sa pag ibig
17 weeks ago,Jenny ***********,Sir may quarantine paba pag uwi ng pinas ano po requirements
17 weeks ago,Marites ***********,Ako po sir tulungan mo makuha end of service ko po 9 yrs isang amo lng
17 weeks ago,FloraMae ***********,"Wla po bng kalamati fund mkukuha sa owwa sa mga nsiraan ng bahay sa,bagyo?"
17 weeks ago,Jasmin ***********,Yung iba kasi sir di sila marunong mag sign up ng one health past
17 weeks ago,Joel ***********,Sir arnel.may ofw loan ba ang owwa.plsss sagot.
17 weeks ago,Jep ***********,Nkapag email at inquire na ako sa ibang program sa owwa pero tagal magreply...
17 weeks ago,Lizalyn ***********,"Sir,paano po ung OFW HOSPITALMeron po ba yan sa Luzon"
17 weeks ago,Wilma ***********,Payo ko lang po kung mag aaply po kayo ng dh mas mabuti po ung may kakilala kayo na naghahanap ng katulong kasi mas ok un kilala ang magiging ako nyo
17 weeks ago,Elvira ***********,"Region 12 po sir.schollar po para Sa mga Anak ko.
nag pass po Ng requarment ang Anak ko Pero dipo sya Napili"
17 weeks ago,Tawing ***********,Oo sir uwi na po kami kasi tapus na po ang ramadan mahirap po ehhh
17 weeks ago,Makulit ***********,Bkt ang hirap dto SA Dubai Ng Philippine consulate ang hirap kumuha ng notarial para makakuha Ng passport anak ko SA pinas
17 weeks ago,Raguel ***********,Sir Arnel one health pass po paki review naman po. Bakit kailangan pa ng time frame. Pahirap po sa ofw di po tau pare pareho ng oras sa Pilipinas. Paki aksionan po.
17 weeks ago,Real ***********,"Sir , good day pano po mg apply scholar sa owwa , kng ang nanay nasa overseas worker ,"
17 weeks ago,Aila ***********,Hi sir watching from malta wth love
17 weeks ago,En ***********,Hai po sir arnel ofw po ako frlm kuwait.....magtatnong lang po sana tunGkol sa sCholarship pwedi kopo bang ipagamit sa bayaw ko ??
17 weeks ago,Madhel ***********,May 10k po ba na matatanggap pag kami ay uuwi?
17 weeks ago,Aljoy ***********,Hillow po sir gud ev po watching in antipolo po
17 weeks ago,Chinarose ***********,sna poh educational asst.
17 weeks ago,Tuiqilop ***********,Sir Sana matolongan nyo po embassy shelter sa qatar Ang daming naka tingga na ofw doin Wala silang makain na ayos at bawal Ang cellphone don...kawawa talaga ofw doon sa qatar
17 weeks ago,She ***********,Fix the system first
17 weeks ago,Arlyn ***********,Pa help po sir arnel nklimang balik na po ako sa owwa dito sa hongkong pra sa cash assistant sa nga ng postive hngga ngaun dkpa nkkuha
17 weeks ago,Pingloy ***********,Sir paano po ung pag avail sa scholarship slamat
17 weeks ago,Victor ***********,Sir arnell humihingi po ng tulong asawa ko po nasa saudi po sya ngayon bininta po sya ng amo nya s ibang agency
17 weeks ago,Elma ***********,Search nyo po ang onehealth pass para makita nyo
15 weeks ago,Leonita ***********,Para po sa pcr test dito sa pilipinas bakit napakamahal po 5000pedos. Parang ginawa na nilang negosyo ang pcr test sa ibang bansa 300peso lang
17 weeks ago,Maryjane ***********,"Sana po PCR test.. vaccination certificate sapat na..
uwing uwi npo kmi...... from Bahrain"
17 weeks ago,Tawing ***********,Sir paanu po makakuha ng scholarship single mom po ako tatlo anak ko tulungan niyu kami
17 weeks ago,Marisa ***********,Sir asked ko lng if 1 yr kna tas gusto mo umuwi obligado Kaba bumili ticket sarili mo Pera tnx for the rply Godbless
17 weeks ago,Madhel ***********,Good evening po.. Mkakatanggap po ba yung ofw na uuwi ng 10k?
17 weeks ago,Trin ***********,SirAno po ba ang makukuha ko sa owwa kung akoy mag forgood as an ofw15 yrs na po nagbabayad
17 weeks ago,Mary ***********,"Dasal lang po kabayan yan po ang tangin gamot ng homesick mo hehe..laban lang po,godbless"
17 weeks ago,Princess ***********,Watching from hk
16 weeks ago,Unice ***********,Sir pls...nka truma na po sa nangyari sa amin ng kapatid ko..tulungan mu po mka uwi kmi ng pinas..
17 weeks ago,George ***********,Paano po yung active pa yung owwa pero na lay off sa work pero ang sahod is more than $600. Pwede po ba kami?
17 weeks ago,Amie ***********,Sir arnel gudevening po ask ko lang po sana anu requirements po sa pagkuha ng scholarship po para sa
17 weeks ago,Elexis ***********,Sir sana po mabasa nyo po yung minessage ko po.
17 weeks ago,Virgo ***********,Sir good evening po..yong tungkol sa ONE HEALTH PASS at OEC..sobrang abala po sa mga ofw kasi po
17 weeks ago,Arlene ***********,ofw insunrance mandatory po any information po
17 weeks ago,Mary ***********,Sir meron po ba housing loan ang owwa pra s ofw?
17 weeks ago,Tiston ***********,sir pa help po ano po dpat gawin ng tita ko nabemta po sya ng amo mia
17 weeks ago,Troy ***********,Sir papano po yung sa AKAP ko po sir di pa ako nabigyan last year pa po ako nag apply nun
17 weeks ago,En ***********,Sir arnel magtatnong lang po koNg pWedi po ba gmitin nang bayaw ko yoNg scholarship owwa......
17 weeks ago,Agnes ***********,Sir paano po mag apply ng scholarship sa owwa po kasi kailangan po ng anak ko mag college po need po namin sana makatolong
17 weeks ago,Pancipanci ***********,Sana ibalik n sa dati wla ng ohp n yan pahirap eh
17 weeks ago,Mhyraflor ***********,Sana po tangalin nlng po ang one health pass kz nkk abala nman po ito sa byahero
17 weeks ago,Imelda ***********,"Sir, paano mg apply ng Scholar for my daughter mg year 12 na"
17 weeks ago,Tessalonica ***********,Sir one health pass tanggalin nalang. May vaccine cert. Naman at PCR TEST.
17 weeks ago,Tongsam ***********,sir pansinin ninyo kami dito sir please matulungan ninyo kami
17 weeks ago,Raymond ***********,"Good evening Sir Arnel, follow po for Dole-Akap 2021 pa po ako na'approved Region 4a po ako. Salamat po."
17 weeks ago,Aj ***********,"Congrats
idol arnel ignacio"
17 weeks ago,Fresnoza ***********,"Sir Arnel, bakit po ang scholarship program para sa mga students namin at may salary bracket?"
17 weeks ago,Grasya ***********,Hi po baka pwedeng tanggalin nalang ang oecpara mabilis naman ang pag bakasyon namin as long may work permit kami ba nag papatunay na nag wowork kami sa abroad
17 weeks ago,Mary ***********,Gud evening sir. Paano po ba makakuha ng schallar
17 weeks ago,Mails ***********,kung myron na po ba insurance bago ofw register need pa ba kumuha ng isurance jan para makakuha ng oec
17 weeks ago,Jennifer ***********,Sir arnel totoo ba na sa amin na ang ticket pauwe nang province namin...salamat
17 weeks ago,Anne ***********,Sir Arnel yong sa ofw Po Sss hindi po ba ang employer ang mgbayad ng monthly contributions sa SSS
17 weeks ago,Salvi ***********,Sir sana sa middle east mataasan n ang sweldo
17 weeks ago,Mila ***********,Concern Lang po ang oec namin na ofw Sana Kung saan kami malapit na owwa pede ng kumuha ng oec tulad ko naga cam sur ako Di daw pede kumuha don pinapunta pa ako Sa legaspi 3 to 4 hours ang biyahe
17 weeks ago,Marilou ***********,"Sir,ano pong mga requirements sa scholarship at paano poh apply sa anak kung college"
17 weeks ago,Esor ***********,Sir mag 2yrs nyung owwa schioarship ng anak ko sa.college wala prin linaw dto sa davao city
17 weeks ago,Lizalyn ***********,Sana po ang mga agency maging responsible pa rin sa mga aplikante nila hanggang sa makauwi ng bansa ang mga pinaalis nila.
17 weeks ago,Mae ***********,Sir arnel owwa membership po ako bakit po selected lang?
17 weeks ago,Esor ***********,Sir ofw.ako sa hk..inaapply ko anak ko sa davao city pero walang sagot pabalik balik n po me wala parin
17 weeks ago,Erickson ***********,ayaw nyo po naman pansinin sir ung mga concern ko salamat po
17 weeks ago,Prosperity ***********,Sana d na pipiliin yung schoolar kahit mababa marka ksi d nmn lahat ng anak ofw matalino katamtaman lang
17 weeks ago,Erick ***********,my time frame kc po yung OHP kya nhihirapan ibang ofw
17 weeks ago,JC ***********,Sir...pwde mag tanong paano mag active yun owwa naka renew nah poh ako
17 weeks ago,Leonila ***********,Sir paki tingnan naman po sitwasyon dito sa Dubai about contract verification....napaka hirap po
17 weeks ago,Marvin ***********,SPIMS po sir! sana bigyan nyo ako nang School Location
17 weeks ago,Lingling ***********,Watching abudhabi
17 weeks ago,ジョベル ***********,Sir arnel. Kelan po ba namin makukuha ung dole akap financial assistance namin. almost a year na po kasi. salamat
17 weeks ago,Victor ***********,Ngayun po wla po sya wifi dun hindi po sya pinapa connect po
17 weeks ago,Joevince ***********,"Watching from Qatar
Sir pakisagot nman po tanomg ko, abt sa assistance po sa affected sa covid19, 1yr na po wala nman tawag o email man lang Sir?"
17 weeks ago,Gemma ***********,Sir Sana ma apply din Ng scholarship anak ko ofw ako from singapore
17 weeks ago,Drachel ***********,Ser kng umuwi ako sa Pinas tpos gusto ko po I pasok scholarship sa owwa pwde po ba kahit hinde na babalik sa abroad
17 weeks ago,Lynmar ***********,Sir ask ko Lang po ung ofw hospital po coverage po ba ang magulang?
17 weeks ago,Princess ***********,Sir pano poba mg apply ng scholarship sa owwa ..single mam po aq
17 weeks ago,Lydia ***********,Dapat may clear guidline sa pag aaply sa mga program ng owwa
17 weeks ago,Crisanto ***********,"Sir arnel,,yung s owwa dole akap po ba one time assistance lang po..? Slamat po.."
17 weeks ago,Abdur ***********,Yong una one stip Lang bat naging 3 stip na...
17 weeks ago,Ibay ***********,Sir Arnel gusto ko po sana maipasok ng scholar yung anak
17 weeks ago,Elexis ***********,Sir yung mommy at tita ko po ay binubog sa kuwait we need ur help po sana mapansin nyo pa po ito.
17 weeks ago,Grace ***********,Ofw schoolarship.na uuwi na at gsto mag aral.sana e priority
17 weeks ago,Remy ***********,Mahirap ko kuning dito my mga amo tlga na ayaw magbigay
17 weeks ago,Sharmaine ***********,Bkt a qnong nagkapositive aq SA covid .walaan Lang aq na tangap galing SA owwa kht man Lang kumustahin aq SA hospital wala saklap
16 weeks ago,Janricks ***********,Need po ba insurance pagbalik ng dubai?
17 weeks ago,Olivia ***********,Sir arnel bka po pwede nio ako matulungam 2years ng maalsidente amg anak ko sa saudi pero d parin kmi nkalakiha sa gosi
17 weeks ago,Dindo ***********,Lahat po ba Ng ofw ay makukuha cash assistance kahit Ng babakasyon lang?
17 weeks ago,Myra ***********,Ofw scholarship program po pno mkkpg avail?
17 weeks ago,Z ***********,Sir may dalawa po ako anak sa samar paano ko po apply cila sa school assitance kahit paano po makatulong sa akin.single mom po ako
17 weeks ago,Riel ***********,"Sir please patulong nmn po kababayan dto sa china nsa hodpital xa need n xa umuwi delekado sitwasyon nya po sir, ito china number po *******."
17 weeks ago,Leah ***********,Ano Anu po ba Ang mga benefits ng owwa?
17 weeks ago,Martina ***********,Sir Arnel Pls help tanggalin na po ang ONE HEALTH PASS PLS..
17 weeks ago,Anne ***********,Hello sir Arnel..panotice po kami pong na approved na sa akap owwa cash assistance makatanggap pa po ba kami sir Arnel
17 weeks ago,Erickson ***********,sir shout out po dto sa polo OWWA riyadh sir pakisabihan naman po case officer ko sir Alaton makipagtulongan sa Agency ko
17 weeks ago,Vick ***********,"bakit sir hindi pa ba sapat ang complete vaccinated na meron kami?...hindi po lahat ng ofw sir eh alam gumamit ng mga makabagong pass,pass,pass na yan..."
17 weeks ago,Janile ***********,Kaya NGA sana ma tanggalin na yang health pass
17 weeks ago,Michael ***********,Ofw kami WALA kami Ayuda kahit peso taking owes po
17 weeks ago,Nellen ***********,Sir puede pa po ba mag apply ng scholarship for incoming colege kaso 2years na ako dto sa pinas?
17 weeks ago,Maricel ***********,Sr para saan po b ang ofw card bkit need p nmin kumuha nh oec meron ofw card
17 weeks ago,Emac ***********,Sir Oec po ang aming gustong ipatanggal
17 weeks ago,Ramosraul ***********,WATCHING FROM MILAN ITALY
17 weeks ago,Nerpa ***********,From riyadh po powidi maki tanong po kasi sabi na amo ko walang veyahi na flainy paponta pilipinas daw
16 weeks ago,Maricel ***********,anu pong mga kailanga pra Maka apply ng exam anak ko.. qatar po ako nagttrabho.graduate n po sya ngayon ng seniorhigh
17 weeks ago,Ma ***********,Pwede. Po ba ang verification ng new contracts sa uae ay gawin ng online pati payments
16 weeks ago,Elsa ***********,Isang bisis Lang Po Ako nakatanggap yong 10 k .. assistance..
17 weeks ago,Jherbhie ***********,Hello po ask Lang Kong mandatory bah talaga ung pag ibig..para makakuha Ng Oec ?
17 weeks ago,Yannie ***********,Sana ser tanggalin na ang onehealth pass.thanks ser
17 weeks ago,Marcela ***********,"Watching from Italy,,pwede n po ba magpachek up s bagong Ofw hospital?"
17 weeks ago,Chad ***********,May tulong padin sana siya makiha sa owwa dahil naging ofw padin po soya naging cover padin siya ng owwa
17 weeks ago,Dess ***********,Yan po Yung sinasbe na kpg hndi buo ag loob wag na mgabroad..
17 weeks ago,Renzo ***********,Libre po ba Yan hospital sa mga ofw sir
16 weeks ago,Jerry ***********,CNBIHAN nya p ko Ng Hindi DAW LAHAT kelangan alam ko dapat DAW my privacy khit tunay n mag Asawa kmi..
17 weeks ago,Mc ***********,Region XI #DOLEAKAP
17 weeks ago,Tuiqilop ***********,10.months tiniis ko sa amo ko kaya dko na kinaya nag run away ako para makatakas sa kanila.. repat po ako
17 weeks ago,Lorenz ***********,Sana my nka pansin nman Ng mga chat k dito
17 weeks ago,Jesusa ***********,Cguro yong mic po medyo malayo sa baba mo
17 weeks ago,Melody ***********,Ako sir hindi n ko bblik kc ung anak ko p myroon s puso gusto k nlng magnegosyo.
17 weeks ago,Winderose ***********,nkikinig p aq dito sa canada Habana nag lilinis
17 weeks ago,Arlene ***********,"good eve sir arnel,"
17 weeks ago,Turoy ***********,Salamat sir Arnel at nging skolar po ng owwa ang anak ko.npakinabangan ko owwa ko.
17 weeks ago,Lhian ***********,"., yung cash assistance poh sir ng dole akap mag 1yr na kami until now pending parin"
17 weeks ago,Juncris ***********,balik pinas program plsss
17 weeks ago,Dess ***********,Mgbbyad po tlga siya kc hndi tpos kontrta.. Pwede po un kung MG 1yer siya hndi na siya pagbbyarin
17 weeks ago,Tuiqilop ***********,Taga baybay leyte po ako nagkataon minalas sa amo ko tapos nagka landslide pa sa Lugar namin sa bagyong agaton
17 weeks ago,Grasya ***********,Pano po namin ma avail 3 po amg anak ko mag la collage ma next year .. pano mag apply po ?
17 weeks ago,En ***********,YuNg tunGkol po sa Scholarship OWWA po sir pwedi po baNg gamitin nang bayaw ko sa ngyon???
17 weeks ago,Davidz ***********,"Hi, requirement poba ang OFW INSURANCE sa mga palabas na ofw?"
17 weeks ago,Memz ***********,Anong requiremnts po para magaply ng scholarship po..
17 weeks ago,Lhian ***********,"., naka full volume na poh kami sir pero ang Hina at ma ingay"
17 weeks ago,Boris ***********,Wala po makuha na slot sa POLO Dubai para sa contract verification
17 weeks ago,Vijandre ***********,Distress ofw po ako ngcapply po ako ng akap s hk pero till now dko p rn po xia nkukuha
16 weeks ago,Lyn ***********,AKAP from region 4A since 2020 pa po di pa din narerelease
17 weeks ago,Jeric ***********,Sir d po ako maka renew sa owwa app. Wala po kasi ung nakalagay na renew icon sa in active po.
17 weeks ago,J ***********,Nahihirapan kami sa OHP yan po ung facts
17 weeks ago,Nelly ***********,"Sir Arnel, gusto ko Po sana apply scholar Ang anak ko Dentistry Po.. nag apoy siya sA NU Moa"""
17 weeks ago,Grazelle ***********,Watching from Israel...Sir paano po maka avail ng scholarship para sa aming mga anak
17 weeks ago,Rhiz ***********,Pangit nang action nang owwa para sa mga ofw parang pagong kumikilos
17 weeks ago,She ***********,Ang hirap po mgapply ng benepisyo s owwa s dmi ng req at forms sa totoo lang
17 weeks ago,Evangiline ***********,Sir sana pcr test at vaccinations certificate na lng ang requirments para makauwi ng pinas.
17 weeks ago,Manuel ***********,Paano po kapag teacher grad and hindi na nakapag exam and nakapagturo?
17 weeks ago,Ihna ***********,Sir Arnel pwede po ba magbayad ng OWWA membership online sa app nio?
17 weeks ago,Aj ***********,Hnd po pwde pauwiin yan lilipat lang yan sir arnel kung ganyan lang reklamo nya
17 weeks ago,Belle ***********,Hi po Sir arnel..tanong kolang po kung paano kumuha ng info sheet ang mga ex abroad po gaya ko.. Gusto kopo umapply ulit ng work abroad.salamat po sa sagot
17 weeks ago,Mariesa ***********,Sir pls help me to renew may owwa scholarship hirap kumuha ng appointment..dubai po
17 weeks ago,Deth ***********,Karamihan dito sa riyadh hindi nasunod sa contrata kaya sana mabanned natalaga dito
17 weeks ago,Eds ***********,sir pano po pag gusto na umuwe tapos bago pa lng po dito sa kuwait gusto ko na po sana umuwe meron po ba ako babayaran
17 weeks ago,لاز ***********,Pwd poh b help nio poh aqu kasi di nasunod un nkapg usap n basic salary q poh d2
17 weeks ago,Roberto ***********,Hi panu po makapag active ulit sa owwa
17 weeks ago,Tessie ***********,Paano po mag aply ng scholarship ang ank ko
17 weeks ago,Airia ***********,Sir regarding po sa scholarship sana
17 weeks ago,Mercy ***********,pwede po b mkpag loan ang isang ofw n finish contract
17 weeks ago,Ghen ***********,"Watching frm qatar sir Arnel.. pwede mag tanung sir kng libre paba pauwi pa province sir?..
flight ko n po sa May 27 Qatar to manila"
17 weeks ago,Aiko ***********,"Sana di nlang ninyo pinaasa mga OFW.1 year na ngayon,wla pa rin natanggap"
17 weeks ago,Inday ***********,"Sir pag maka avail po ba sa 20k assistance na scholarship assistance, pwed po ba mag apply nung isang klase scholarship na may exam?"
17 weeks ago,Dzenet ***********,Sir Anrnel ask lang po ano na alsypn sa DOLE AKAP NAMIN 1YR NA DI NAGPIPIGAY PAY OUT..PLS HELP.
17 weeks ago,Ballena ***********,"Sir bakit po SA scholar ship sir di puwede ,,sana po matulongan Po ninyo Ako sir"
