date_raw,sender_name,text
5 days ago,Jestonee ***********,loslos ninyo anong silbe ninyo pang kurakot lang
5 days ago,Kim ***********,Good evening po sa nyo Tanong Ako tungkol Doon sa covid19positive assistance dto sa taiwan po Ng ung tungkol sa medical cert. na need ung sa pcr at under quarantine kc po Ng pasa na Ako Ng req gumastos at ngbabsent pa Ako sa trabaho bkit invalid prin un ei gling na un sa doctor ung medical certificate
5 days ago,ۦۦ ***********,thank you po dole akap natanggap ko na po
5 days ago,Mirasol ***********,"For my concern: for about dille akap assistance po magiisang taon n po ako s pinas hanggang ngaun po wala pa...last month nagpasa n po amo requirements hinihinge nila for evaluation daw po,sana po marelease na."
5 days ago,Henlimitz ***********,Makadismaya ung owwa
rs ago,Lorena ***********,"PAANO PO YONG BALIK PINAS. PARA SA, MOTHER KO PO.."
5 days ago,Clarita ***********,Pedro Reyes po un name ng kua ko nsa riyadh po cia..pktulungan po ninyo cia..salamat po 60 yrs old n po cia..
4 days ago,Cristina ***********,Hindi po maka register sa owwa app
5 days ago,Aaron ***********,"Ako active ko last bayad ko owwa feb18, 2019"
5 days ago,Gina ***********,Hello pOH I'm watching from Riyadh
5 days ago,نور ***********,Good evening po mga sir
3 days ago,Marilyn ***********,Ask ko lang poh OWWA Overseas Worker Welfare Administration ask ko lng poh sana kung pano po mag avail ng libreng scholar kc poh parehas ng nag aaral yung dalawa ko pong anak sana po mabigyan din po ako ng balik pinas hanap buhay sana po mabasa niyo po ito maraming salamat po and god bless po.
rs ago,Susan ***********,Pls po ..para po s scholar ship Ng anak q..pa check naman po .pa register namn po q s owwa..untii 2013 ofw n po q..Ng bumalik po q 2019 dto .untill now dpa dn po q naka register. .dahil po s full laging appointment nila s online..pls help me po.para maka avail po anak q.now po grade 12 n.pls po
5 days ago,Gina ***********,Hello pOH
rs ago,Vami ***********,hello
5 days ago,Kyle ***********,Nag message na po ako sir sa OWWA whatsapp kaso wala pa pong update. Sabi naforward na po sa POLO KASO wala pa pong update.. gusto kuna po kasi makauwe talaga’ dito po ako ngayon SMASCO RIYADH..
5 days ago,Tothip ***********,Watching from Qatar may friend po ako nanghihingi ng rescue sa kuwait pa help po
5 days ago,Tothip ***********,Watching from Qatar pero may friend ako nagpapa rescue sa kuwait no. Ko ******* san po pwede ma send details nya salamat po
5 days ago,Robert ***********,Juna Garcia Guinang po pangalan nang asawa ko po. Ito po employer niya ALI HAMAD M A AL SULAITI ******* Add. House no. 24 Zone 56 street 664 bu hamour doha qatar. Ito po new employer niya kasi mali po nasa contract details niya SAFIA MOHAMMED N AL HAJRI ******* ADD. AL ASSAILA STREET 168 or 618 Zone 80 gate #6
5 days ago,Tampolino ***********,Good evening po.sir sana po matulungan nyo ng tulong pinansyal. Si sis Jahara K. Kedo kadarating po nya dyan sa pinas d po sya makauwi sa probinsya nya at wala po sya kaperapera.ilang taon din po syang nzgtrabaho bilang ofw sana po may matanggap po syang tulog.at pangpamasahe po sya at pang negosyo.
5 days ago,Milette ***********,Hello po sir Arnel sna mtulungn nuo po un mga Ngpositive Dito sa pinas n pingbksyon Ng amo ts ayw n bilhn Ng ticket kc malki n dw gastos Nila kya labs terminate kht nd MN lng nbgyn chance mkblik pra makhno Ng bgo amo at sna mkakuha din Ng cash assistance un mga Ng positive s covid Dito s pinas kaya ayw n pabalkkn Ng iba amo
5 days ago,Maricris ***********,Magandang Gabi po. Watching here in UAE.
5 days ago,Marilou ***********,MAM SIR ILANG BUWAN BA BAGO MATANGGAP ANG BALIK PINAS BALIK KABUHAYAN NA ASDISTANCE PO NG OWWA
2 days ago,Myrna ***********,Tanong q lang po 8 yes npo aq s amo q d2 s Riyadh Saudi Arabia starting July 8.. gusto q n po umuwi s December dhil pagod n dn po Katawan q my makikuha po b aq pera mula s mga smo q.. s ngaun po nk 1yr n aq dis July prang dq n po mhintay ma finish contract aq madami npo kc aq barramundaman s katakana q..57 yrs old npo aq
5 days ago,Marilou ***********,For your concern/s
5 days ago,Rhose ***********,hello poh pano poh gagawin kapag ayaw ibalik ng agent yung passport at docs mhu nag backout n poh kc aq at ayaw q n poh umlis nagsvpoh aq wala png visa wala pa din poh aq napirmahan na contract at d pa na med ayaw poh iblik at cnasav nia n kapag d aq tumuloy mag babayad aq ng 400$ at papabaned daw poh aq sa poea at dfa
rs ago,Precy ***********,Sir mam bkit po noong nagbakasyon po ako noong 2021 Ng december.tpos sabi nla my nakuha ako Ng cash assistant na 10k Ng fil up po ako tpos my Ng chat SA akin magtanong cya cnagot ko LAHAT Ng tanong nya hanggang nakabalik na ako hndi ko nakuha ung cash assistant na Yan ung kasama ko nakuha bkit po ako wala
5 days ago,Ayami ***********,Pano po ba mag apply ng scholarship s owwa
5 days ago,Gracia ***********,Sana mapansin message ko
4 days ago,Aliehs ***********,"Sana po matulungan ninyo kami makauwi ng ligtas ang kapatid ko na si LEAH GRACE DIONISIO, na dinala ng amo sa psychiatric hospital nasa Kuwait po sya. Ibinili sya ng amo nya ng ticket pauwi pilipinas sa Sept. 4 sana makauwi sya ng ligtas kung siya ay may Medical condition, ******* po number ko sana po matulungan ninyo kami"
5 days ago,Rechel ***********,Sir paanu po mag apply scholarship sa owwa para dlawa ko anak Isang grade 11 at grade 9 ty po watching from riyadh
5 days ago,Tothip ***********,Watching from Qatar may friend po ako nagpapa rescue sa kuwat no ko po ******* san pede ma send details nya im precious po
5 days ago,Kyle ***********,Nag message na po ako sa OWWA sa whatsapp po’ kaso wala pa pong update 3 days na po nakalipas sabi daw po na endorsed nadaw po sa POLO yung complaint ko
5 days ago,R-Cel ***********,Mga ma'am/sir sana po mapansin niyo po ako matagal na po ako nka file ng repat dito sa Riyadh city po hanggang nguan wla pa din ako update po Rucel Alampayan #*******... Sana po mapansin nyo po ako 2months na po ako dito nkatingga s Agency ko po puro lng cla pangako s akin mabigyan ng exit visa pero hanggang ngaun wla pa din po.. Pa help po ma'am!/sir
4 days ago,Loise ***********,"Love
Love Love Good Vibes Watching From Austria"
5 days ago,Tothip ***********,Watching from Qatar may friend po nagpapa rescue sa kuwait no ko po *******
5 days ago,Jessabel ***********,"SNA PO MABIGYAN NYO PO AKO NG NUMBER NG POLO RIYADH OR EMAIL PO KASI, MASAMA NA PO ANG KALAGAYAN NG MAMA KO DOON MINAMALTRATO POBSYA NG AMO NYA MAY MGA PASA AT BUKOL PO SYA SIKO NYA SAAN MA RESCUE NA PO SYA NG POLO RIYADH PO, NAG PUNTA NA PO AKO SA POEA NOONG MARTES TAPOS, NAG TEXT NA DIN PO AKO SA OWWA WLA PA PONG RESPONSE SA POLO RIYADH PO!"
5 days ago,Elsa ***********,Gdpm watching from singapore
5 days ago,Rosaleo ***********,Name:rosaleo.aquino
5 days ago,Aisha ***********,Sa scholarship po sir may range po ba ng salary para makakuha ng scholarship
5 days ago,Norjamen ***********,Scholarship/gaano katagal makapasok kasi nakaapply kami Nung June/July
5 days ago,Jen ***********,Sir ilang buwan po ung repat makauwi ng pinas
5 days ago,Palawan ***********,Good evening sir isang ofw po from saudi bale mag 2 years narin po ako dito pinas nais ko lang po sana humingi ng tulong sa inyo dahil hinde po sapat yong sahod ko kc yong mothers ko is 78 years old na so ako po nagaalaga sa kanya meron isa po syang señor kaso hinde nman sya nakakatanggap mag 2years narin hinde nakataggap ng kanyang sèñor cetizin nais
5 days ago,Elvie ***********,Good evening po sr baka pupuwede humingi talong sa inyu.isa po ako.ofw sa Qatar 11years 4monht po ako November 8 umuwi po ako dahilan sa karamdaman ko ang mandatory tinatawag po hiningi ko sa amo ko hindi binigay kanino at san ko po pupuwede ilapit ang problema ko kahit sa dole acap wala kong makuha.sana po matulungan ninyu ako cp number ko po *******
5 days ago,Donna ***********,"Sir gud pm po pa notice nmn po ng concern q Oct. 1, 2021 p po aq nka uwi ng Pinas nag apply po aq sa dole akap sb po approved n dw po application q apr. 4 sla nag msg skin.. May list po from owwa ng na approved March to June po release na sa dole akap pero wla po dun ang name q.. Anu po bang pde q gawin.. PA help nmn po slamat.."
5 days ago,Lyndel ***********,"Sir tanong Lang poh Yong mobile I'd ko na gin download ko SA app poh, mobile I'd.tapos nag registered ko nakita na ko council na. At wala naden ako contract 3years na ayaw pa ni sir e renew.8years na poh ako isng employer. Tapos Hindi pa mag bigay end of contract tapos Hindi sumonod sila SA contract. Ang day off ko ones amoth only"
5 days ago,Kyle ***********,"Hello po. nag message na po ako sa OWWA whatsapp’ kaso 3 days na po nakalipas, wala pa pong update, pero sabi po na forward na po sa POLO ang complaint ko po."
5 days ago,Maria ***********,Sir ask lang po paano po maging active ang owwa records ng Mr. Ko .. Actually every 2 yrs po cya ng babakasyon d2 sa pinas tapos babalik na naman po.. Kaya lang simula nung pandemic hindi pa po cya na kakauwi Bale mag 4 years na po cya sa feb. 2023... Gusto ko po sana maging active ung owwa records nya para po makapag apply ng scholarship ung anak nya po
5 days ago,Jen ***********,Ilang buwan po sir mkauwi ng pinas pag repat po.?
5 days ago,Milette ***********,Natabunan n un messge ko po Sana mbasa nyo din
3 days ago,Jhezzlyn ***********,Sana po magbigyn pansin tong akin coment sir arnel ihope po MG karoon din po kau NG program Para sa amin mga ex road na na tingga sa mga egency my mga pamilya din poh kami Lalo na po ngaun pasukan na. Pano namn po kming umaasa makaalis pero hindi PA MA left ang band. Sana po kahit konting tulong lng galling sa owwa. Maraming salamat poh good blessed us
5 days ago,Margie ***********,Good evening Po watching from Bahrain tanong ko lang Po nag pa check up Kase ako d2 at may Nakita pong 2 cyst at gallstone Ang Sabi po ng doctor kailangan dw Po maalis at ipa biopsy nung sinabi ko Po sa madam ko pero ayaw nila kumilos at ayaw nila gumastos at Jan ko nalang dw Po ipa opera pg uwi ko next year paano Po gagawin ko Margie de Guzman Alcantara Po
5 days ago,Grace ***********,Sir Sana mapansin po
5 days ago,Yam ***********,Please po p notice.. may kaibigan po ako sa riyadh nasa agenCy po need nya po makauwi ng pinas kc mag expire na visa nya next week. Pero may babayaran po sya at sya din po bibili ng ticket kc na terminate po sya.. now po problema talaga siya dahil wla po syang pambayad sa agency at wala na po sya pambili ng ticket... please po maawa kau e notice nyo po salamat
5 days ago,Jen ***********,Ilang buwan po makauwi ng pinas pag repat mo sir? Dito po uae
3 days ago,Necy ***********,"God day po
Ask lng po.... Pili lng ba ang maka sali sa ofw scholarship... Mag apply sana anak ko college na... Naubosan daw nang slot at unahin daw yung sa Province,, pano anak ko.???ofw din ako dto sa bansang Bahrain anim anak ko,, region 11... Sana mapansin nyo ako.. Hnd nman mababa grades nang anak ko..."
5 days ago,George ***********,Pwede po ba ipagamit ang scholarship sa anak NG pamangkin ko
4 days ago,Maria ***********,Name:Maria Luz A Bilbao
5 days ago,Rose ***********,Sir/ma'am: ako si Roselyn L. Quisol
5 days ago,Cherli ***********,Tulongan po ninyo aq na makauwi
5 days ago,Maine ***********,Rosalie mahusay po sir sana patulong nio po ako ang isang taon napo ako dto sa qatar ang amo ko po nanakit sinabi konarin po sa agency ko sa pinas pero wala parin silang action na ginawa shopia Natasha name ng agency ko sa pinas sana po mapansin nio ang message ko gsto kuna pong umuwe sana po matulungan nio po ako sir ito po number ko sa qatar******* Doha Qatar po ako
5 days ago,Rosemarie ***********,Sir sna matulungan nyo ako dalawa Po college bka Po kahit Yung isa Ang mag avail ng scholarship kaso dipa Po ako nka renew gawa ng Wala pong stamb Ang contrata ko at sa labor Po at kinuha din passport ko ilang beses ko na sinabi na need ko contract with stamp at sa labor wla nman Po aksyio eh 1year mahigit na Po ako sa kanila ddito Po ako oman sir Rosemarie narag
5 days ago,Clarita ***********,Pedro Reyes po un name ng kapatid ko.
5 days ago,R-Cel ***********,Mga ma'am/sir nka apply na po ako ng repat po Rucel Alampayan po #*******.. 2months na po ako nka tingga dito s Agency ko po hanggang nguan hinde pa rin po nila maibigay ang exit visa ko po...pa help po ako riyadh city po ako
5 days ago,Maria ***********,dole akap po wala pa update
5 days ago,Vilma ***********,"Sir saan ko po sir ipadala yong papers ko na katunayan na binigay ni madame ko kay sir RICKY CORDOVA POLO RIYAD SIR. IM VILMA DAILEG PO ******* BALE 12 , 000 SAR YONG END OF BENIFITS KO TAGA QUIRINO PROVINCE PO AKO TEL NUMBER SI SR RICKY PO AY ******* AYAW AKONG SAGUTIN AUGUST 22 PA BINIGAY PERA HINDI KO PA NATANGGAP PLS. SIR HELP ME TO VONTACK POLO RIYAD PLSSSSS"
5 days ago,Dess ***********,Sir tanong lang poh mag 4years na poh ako sa amo ko may makukuha poh bah ako benefit sa amo ko?
5 days ago,Alay ***********,OWWA Overseas Workers Welfare Administration
5 days ago,Aisha ***********,May range po ba ng salary sir? Para maka avail ng scholarship ?
5 days ago,Tabs ***********,Good Evening Sec. Arnel Ignatio. Tanong k lng po yung end pf service award at delayed salaries ng Azmeel Contracting Co. Jubail KSA..Hinge po kmi ng tulong dahil sa 3yrs npo walang responsed galing sa Owwa Riyadh po. Sna matulungan po ninyo ako. Retired OFW npo ako at kasalakuyan andto sa Pinas po. Name: Edwin V. Abakan Azmeel Contracting Co. JUBAIL kSA..
5 days ago,R-Cel ***********,Mga ma'am/sir nka apply na po ako ng repat po hanggang ngaun wla pa rin po ako update mga ma'am/sir.. Ako po Rucel Alampayan po #******* 2months na nkatingga po dito s Agency ko po at wala din maibigay ang exit visa ko po ng Agency ko po sana mapansin nyo po ako
5 days ago,Hanna ***********,3yrs 3months na po ako never ko po nakita contract ko po
4 days ago,Lyn ***********,Good afternoon po sir /mam.... Pauwe po aq nitong Dec... Ano po b dpat Kong gawin.. Dhil sa left eye q po ehh cornea burn dpa po gumaling... Ang alga q po nkaaksidente sakin nasprayhan niya... Na stop po gamutan q... Mkkakuha b aq NG financial assistance galing sa amo.. At gusto q rin Sana mkuha Yung 2months na bonus sa knila dhil almost 4 yrs nako sa knila d nman binibigay khit plane ticket q nun
3 days ago,Edgrace ***********,For your concern/s
5 days ago,Sheryl ***********,Gudevening po
5 days ago,Ehj ***********,For your concern/s
5 days ago,Edith ***********,Watching saudi arabia
5 days ago,Maria ***********,Name: RAMON F. PASCUAL
5 days ago,R-Cel ***********,Good evening po mga ma'am/sir sana po mapansin nyo po ako dito po ako sa Riyadh city po nka file na po ako eg repat pero wla pa din ako update po.. Rucel Alampayan #*******.. Hanggang ngaun wla pa din exit visa ko po puro pangako lng to Agency ko po 2months na po ako nkatingga dito po.. Plss gusto ko na po mkaowe mga ma'am/sir
ay ago,Raida ***********,"Patulong po sir.Arnel Ignacio na Sana makaUwi na po Ako sa Pilipibas OFW, sa UAE po pinabayaan lang nila Ako Sa Agency ku na may Sakit At Mina Market po ng Limam beses at hindi ku po nakukuha Ang 23days na Salary ku po sa Una kong Amo at 5trials days sa iba ku pong Amo
At niluko po Ako ng Kumuha po sa Akin d2.At Sanay matulungan neo po Akong MakaUwi sa Pilipinas Thank you somuch po And Godbless"
5 days ago,Marichu ***********,Hehehehe napakahirap humingi ng tulong sa inyo lalo n kaming mga unfinish contract dahil pinaalis ng amo ng biglaan sa kadahilanang nakikinig sya sa mga sbi sabi ng kasama nmin....nkailang punta na ako sa intramuros guwardya lang humaharap at sinabing mag pa appointment muna.nagpa appointment po ako umabot na ng 2025 ang napindot nmin sa computer wala pading available hahhaha.grabe. .....sana mapansin nyo kaming mahihirap
5 days ago,Felizarta ***********,Sir kailan makuha dole akap
5 days ago,Kyle ***********,"Nag message na po ako sa whatsapp owwa number, kaso sabi daw po nila naforward na po nila sa Polo yung complaint ko, kaso wala pa pong update, 3 days na po. Nandito po ako ngayon sa SMASCO RIYADH yan po name ng agency po namen.. gusto kuna po makauwe. Sana mabasa niyo po."
5 days ago,Mhal ***********,Hello po sana mapansin
5 days ago,Yan ***********,For your concern/s
5 days ago,Bonifacio ***********,Pano po mag membership yan.
4 days ago,Aliehs ***********,"Hi po 4 months pa lang po kapatid ko sa Kuwait, noong Aug. 20 po huli namin siya nakausap ok naman po siya tapos 21 dinala daw po sa ospital natagpuan unconcious daw ikinuha ng amo ticket pauwi ng Sept. 4 po tapos after 3 days inilipat daw po sa psychiatric hospital nasabKuwait po sya, ngayon di daw po pede mag travel mag isa kapatid ko hingi po ako ng tulong para ma assist ang kapatid ko na si LEAH GRACE DIONISIO upang makauwi ng maayos at ligtas"
5 days ago,Juvena ***********,"Pagingi nmn po advice ano dapat ko gawin kng paano ko mkuha vacation pay leave ko,kinausap ko amo ko tungkol jan sabi hndi nmn daw ako ng bakasyon,at sabi nya saka nya lng ibibigay yung pera png plane ticket ko sana nung ng 2yrs ako ng extend ako 4yrs n ako nung august 26,may nabanggit din xa sbi nya papatayin daw nya ako pag malapit n ako uuwi tpos sbi nya joke lng daw.sana maoansin nyo comment ko stress n po ako sobra sa amo ko."
5 days ago,Jross ***********,SANA PO MAPANSIN
5 days ago,Wingz ***********,Sir ask ko lng po if available pa po ba ung grant ng owwa po ung group business opportunity po. Thanks po sa sagot sir and maam
5 days ago,John ***********,may 2 mnths pa po ako na d nkuha sa knya
5 days ago,John ***********,hello po sir
5 days ago,Vhanic ***********,malapit na mag isang taon
5 days ago,Maria ***********,dole akap po kailan po mabibigay?
5 days ago,Cez ***********,Watching fr kuwait po
5 days ago,Izylle ***********,"Hello po. Gusto ko napong mapauwi si papa, nasa saudi sya ngayon. Nais ko po sana na mapauwi na sya, dahil 5 months na po siyang walang sahod tatlong buwan na din pong walang trabaho at 10 months na pondo nila sa kompanya hindi pa naibibigay."
5 days ago,Ce ***********,Watching saudi arabia
5 days ago,Daniella ***********,Hi po ako po c BERNADETTE CARABUENA RIVERA po humingi ng tulong da inyo kasi po mg apat na bwan na po ako na walang trabaho at fet to work ako sa pinas pero dito sa Dubai ako nag kasakit ng pulmunai at asthma po sir and ma'am naka tingga ako dito sa accommodation at parang awa nyo po tulungan nyo po ako gusto kuna umuwi ng pinas pina pabayad ako ng 126 derham ng agency ko na tadbeer at inde nila ako pa uwiin pg inde ako maka bayad at kahit pamasahi nga walang2 ako
5 days ago,Rubhy ***********,Hello po sir an mam dto sa Qatar my makukuha ba kmi ng ng end of services
5 days ago,John ***********,watching from oman po
5 days ago,Jannet ***********,Watching fromUSA
5 days ago,Marites ***********,Watching Saudi Arabia
5 days ago,Ejlyn ***********,Hi po watching Kuwait
5 days ago,Mhal ***********,Ipinapasa lang nila
5 days ago,Felizarta ***********,Dole akap sir mg 2 year's na wala padin natanggap
5 days ago,Mhal ***********,Wala mga magawa Ang polo
5 days ago,Jocelyn ***********,Please po......
5 days ago,R ***********,Sir kumusta Andyan kanapala dyan ala Kana sa Jeddah?
5 days ago,John ***********,qurom po
5 days ago,Roselie ***********,Saudi Riyadh po sis
5 days ago,Gerodias ***********,Hello po im watching from Dammam
5 days ago,Ana ***********,For your concern/s
5 days ago,Setyembre ***********,"Tanong ko lang po,,first timer po ako dito ako sa kuwait now,8months na,,chineck ko po kase yong owwa ko s owwa apps,bakit wla po name ko,,nkalagay naman po sa oec namin na bnayadan ang owwa namin,,tas yong ka agency ko nagpacheck din cya dto sa embbasy ng kuwait,,wla dn po name nya,kaya ngbayad na lng po cya ng 8KD posible po ba na dinaya lng kmi nang agency namin?,,halos lahat kmi ng mgksabay umalis di kmi mkapgregister sa owwa apps kc no account dw,,Pacific star International employment agency po name ng agency namin sa pinas,,sana po masagot nyo po tanong ko,maraming salamat po,,"
5 days ago,Chuvz ***********,For your concern/s
5 days ago,Chelo ***********,Hellow po .watching from kuwait
5 days ago,Michael ***********,"Hi po, pa shoutout po kay Kylle Wella G. David"
5 days ago,Andrei ***********,good eve sa inyo sir..4years na ako wala uwian sa pinas..so means 4years ako wala bakasyon..last 2020 last finish contract ko at this sept. 2022 na ang pang 4years ko dito sa saudi arabia..ask ko lang sir kung kasama.ko va makukuha sa end of contract ko un Vacation pay ko last 2020 and this year kasama narin ba doon ang ESB computation last 2020 and 2022..kasi mag exit na ako eh..salamat mga sir and mam..vacation pay + esb ko last 2020 and 2022 + salary =???
5 days ago,Kyle ***********,Sana mabasa niyo po message ko’
5 days ago,John ***********,shout out from oman
5 days ago,Ladyrose ***********,Bakit sir aq 2018 pa aq nag uply ng balik pinas sa zamboanga city laki ng ginastos q pabalikx2 kc un ang sabibnila alam ninyo sir mahirap lang poh aq at single moom bakit hindi pa nila ibigay hindi nman sa kanila un.ung tomawag aq sabi jan nadaw ang chegue .ng nag ponta nanaman aq sa zamboaga city sabi naman wala pa e ang layo q sir sa zamboanga sibugay po aq hangang ngauon 2022 wala pa akung natagap.mahirap na nga pahirapan pa sa mga empleyadong mga mokhang pera din.******* ito poh number
5 days ago,Kyle ***********,Sana matulungan niyo na po ako makauwe. Nag message na po ako sa OWWA whatsapp mobile.. kaso wala pa pong update. Ang huling reply po sakin na endorsed nadaw po sa POLO ang complaint ko po. Pero 4 days na po wala pa pong update. Sana matulungan niyo po ako. Nandito po ako ngayon sa SMASCO RIYADH. Hindi po ako makauwe kasi may kailangan pong bayadan sa agency. Terminated po ako.
5 days ago,Angelina ***********,Dito po sa kuwait
4 days ago,Cezarson ***********,Magandang gabi po may reklamo lng po ako tungkol sa aking asawa na isang ofw sa riyadh nagka relasyon po kasi sya sa isang driver duon na pilipino din at may pamilya din dito sa pinas ngaun po binabali wala nalang po ng asawa ko ung limang anak namen at pinag bablock pa po kame sa fb nya at panay pa po ang post nya sa ngaun ng kung ano anong sexy na damit ang suot nya may pananagutan poba ung agency nya kasi hindi manlang po ako pinansin ng agency kahit nagreklamo na po ako sa kanila
5 days ago,Blog ***********,I'm watching Qatar
5 days ago,Abby ***********,ako po c bainano ali bungay galing napo ako dubai kakauwe kolang po kc nag cancel amo ko bago kc ako nag apply sinabi ko sa agency na hnd ako perfect sa English at hnd ako maronong mag luto ng Arabic food pero nilagay nila sa cv ko cook kaya nag cancel amo ko at nag positive din ako don sa accommodation..bumubok ako ng ibang amo pero bumalik ako sa agency kc hnd ko po kinaya at galing narin po ako sa saudi ******* at active pa po owwa member ko sir kaya sana po mabigyan nyo ako tulong sa cash assistance...
5 days ago,Apple ***********,Mam sir gud ev. Po pahingi tulong sa frend ko po sa dubai 4 months na po sya sa accommodation d pa naka uwi kasi pinababayad daw po sya 126dirham. Nag kasakit po sya my mga msg daw sya ky sir at ntwagan sya pru mahina net nya sna mapansin po pakitulongan salamat po.. Sensya na po d2 ako nag msg pra mabilis po aksyun kawawa naman po c BERNADETTE CARABUENA RIVERA. Humihingi po tulong pra mka uwi ma sya my sakit po sya nasa dubai po sya now. PHILTEXT AGENCY nya sa pinas. Sa dubai TADBEER ALSAADA AGENCY. PLEASE Patulong po. Salamat god bless
5 days ago,Felizarta ***********,Sir mag 2 year's napoh wala padin dole akap
5 days ago,Daisyroxas ***********,Ako dito sa kuwait
5 days ago,ليزا ***********,For your concern/s
5 days ago,Clarita ***********,Hi po good afternoon po..Gusto ko pon humingi ng tulong pra sa kua ko po..nkuha n po nya un exit visa..bgy ng polo kaso po d po pa binibigay un end of service nya at kung kulang n sahod nya..pktulungan po ninyo.. nsa riyadh po cia d n rin po cia pinappasok sa trabaho nya wla po cia trabaho sana po matulungan po ninyo un kua ko 60 ages old n po cia..n mkuha nya lht un sahod nya at end of benifits po nya salamat po dto po ko sa kuwait isang din po ofw....pkitulungan po ninyo cia..wla n rin po cia allowances pra sa pgkain nya..salamat po
5 days ago,Jandan ***********,Good evening sir tanung ko lng po isa po ako ofw sa UAE po pero nakauwe na po ako. Kadahilanan na lagi po ako nagkkasakit po 7months lng ako sa amo ko pero ako po ang pinabili ng Egency ng ticket ko po . Tanung ko lng po if makkuha ko ang na gastos ko po sa ticket ko at pinagbayad ako ng Egency sa. 395sa pulis kasi kinasohan ako nila ng absconding na ndi nmn po ako tumakas at pag hatid pa po skin pinagbayad ako 300drhm sa driver ng Egency po pag hatid skin sa airport .
5 days ago,Vinalyn ***********,"Dear sir Arnel Inagsio,tanong lang po.yong kapated ko x abroad ng Bahrain matagal sya noon mga 20 yrs ata yon ,ngayon nagkasakit sya dyan sa Bahrain. Ng diabetic kaya nag exit sya,noon at ngayon hindi na sya makakita 56 taong gulang na sya ngayon. Naawa kami sa kanyang setwasyon Naga mentain ng gamot malaki gastos buwan lalabas lang din ng hospital ng GenSan,sabi ng doctor my tubig ang baga kaya hindi Mona maabunohan ng dugo kasi maputla,at May sakit sa heart. Pwede pa ba sya makakuha ng tulong sa awwa pangalan po yoliada b Masamloc single po sya.thank you"
5 days ago,Felizarta ***********,Sir pano Naman dole akap mag 2yaer na wala parin
5 days ago,Felizarta ***********,Sir mag 2year napoh Ang dole akap wala parin Ako nakuha
5 days ago,Roem ***********,Goodeve po sir
