date_raw,sender_name,text
17 weeks ago,Bernadette ***********,Sbi nmn po may makukuha daw po aq rebate dun po sa may intramuros sagot nmn po saken donate nlng daw po sa needy...aq po needy rin kse Tatay q po nung mga panahon na yun Cancer patients... may chance po ba aq maghabol dun sa graduity q po
17 weeks ago,Lani ***********,"Hi Sir Arnel, NO. 1 issue po ng mga OFW na uuwi ng Pinas is about One Health Pass Registration, in regardless of Age or occupation basta galing ng abroad we required to register kahit na po na fully vaccinated na kami. Sana po paki review yung reuirements"
17 weeks ago,Wendellrimorin ***********,"Sir mag 2yrs na ako dto sa February 7,2022 pero hanggang ngaun d po nla binibigay yong kulang na sahod ko, kc po sir yong pinermahan ko sa contrata ko 160 Oman riyal pero 150 lang po binibigay sa akin sir, makukuha ko po ba yong kulang pag uwi ko po"
17 weeks ago,Roda ***********,"Sir, kailan mag oopen ang online appointment ng OWWA? Palaging ""No available slot"" since last year pa po ako nag ttry mahpa appointment kasi mag aavail ako ng OWWA Scholarship ng anak ko, mag 3rd year college na this coming school year pleaseeee"
17 weeks ago,Ever ***********,Sir dati kc 3 days ung one health pass ngaun nagbago un my 24 hours bgo ang departure s pag fil up after nun myrun pa n 12 hours bgo p makakuha ng qrcode tpos bgo mag 4 or 1 hour need uli verify ung sagot nla ang hirap jan po eh kpg ala enternet ang mga ofw
17 weeks ago,Merfe ***********,"Sir, One Health Pass Concern: mayron po kase akong kilala na uuwi, pinapatanong po kung yung requirements po ng One Health Pass, kung vaccinated po ba, need din po ba isubmit pareho yung rapid test anti gen, pati yung pcr result? Confusing po para sa kanya."
17 weeks ago,Ramosraul ***********,IDOL ARNEL TANONG KO LANG PO PANO KO PO MALALAMAN OR MAKUKUHA ANG 200 DOLLAR NA AYUDA NG GOBYENO SA KATULAD NAMING NAG KASAKIT NG COVID MAG ANAK PO KAMING NG KASAKIT AT 3 KAMI NAKA PAG APPLY NA PO KAMI SA DOLE PIRO WALA KAMING NAKUHA SALAMAT PO
17 weeks ago,Ande ***********,God bless
17 weeks ago,Dhel ***********,LEBANON here no sounds po
17 weeks ago,Rhiz ***********,"Hello po sir arniel sana po wla nang oec ang balik manggagawa basta may ofw ecard nlng sana gamitin po sayang ang card na yan ang ganda pa naman wlang gamit sa amin, at sana lahat nang anak ofw free scholarship po at my medical insurance sa pinas"
17 weeks ago,Hernandez ***********,"Sir pwede po ba tangalin na ung one health pass, kung full complete vaccinated naman po kame sa bansang pinaggalingan namin, every 14 days po kame free prc dito sa bansang uae, at fully vaccinated din po, pwede un nalang ipakita as long na updated po lahat."
17 weeks ago,Rose ***********,"Sir sana din po matulungan nyo Rin pong makauwi si GINA RAMBAOD po dito po sa KSA,,TITA ko po sya SIR....Yung amo nya po(not original employer) nawala nya daw po PASSORT nya KC ayaw ipahawak sa kanya Yung passport nya at LAST JULY PA PO FINISH CONTRACT sya"
17 weeks ago,Joseph ***********,"Dapat lahat kami mga ofw bigyan ng mga scholarship mga anak na men sir arnel... sana na man po sir arnel, alisin na po yong ohp na yan... tignan na lang po nila mga vaccine record na men... dami po nahirapan d2 sa riyadh k.s.a. tnx po sir arnel.... god bless..."
17 weeks ago,Princess ***********,"sir please o, tulungan nyo po ung mg tita ko s kuwait, po binugbog po cla ng amo nila, hnggang ngayon po wla p cla na medical, dlwa po cla, ang gusto san nila mka uwi ng pilipinas. need daw nila mag bayd sa agency, cla n a po binogbog cla pa mag babyad."
17 weeks ago,Carina ***********,Sir arnel tanong lang po isa po akong ofw updated po ako sa pagbabayad ng owwa every two years..pwede ko po bang maging beneficiary ang aking pamangkin kase kase wala po akong anak at wala na rin magulang pareho po kami ng mister ko isang ofw.Salamat po
17 weeks ago,Shein ***********,"Sir arnel pano po ba maka avail nung benefits para sa mga anak ng ofw na nag aaral sa kolehiyo sobrang hirap na po kc sa pinansyal para sa mga nag aaral eh, sayang naman po para po makatulong sa anak qng college in cash assistance.. Thankyou po.Godbless"
17 weeks ago,Marlyn ***********,Good evening po Sir watching from Dammam Saudi po. Mostly po pinaka worst na problems po nmin ngaun is ito pong One Health Pass na isa sa requirements pauwi po dyan sa sarili nating bansa po. Sir. Salamat po sa tugon Sana. Maialis na po yang One Health Pass na yan
17 weeks ago,Jeff ***********,good evening sir Arnel patulong po ako makuha ung pera ko s national commercial bank NCB s Riyadh Saudi since 2015 p po ako nkauwe ng pilipinas at Hinde n ko nkabalik ng Saudi ano po b dapat ko gawen para mkuha ko p ung pera ko s banko NCB patulong nmn po
17 weeks ago,Martina ***********,Sir mayroon na po kami mga Vaccination card my booster po kasi binigyan lng po ng one day registration from 3 days before departure ngayon po ay one day lng before departure bago mag register po sa Link ng One Health pass..pls Sir ang daming nahihirapan dito
17 weeks ago,Jannet ***********,Gandang Gabi po Sir
17 weeks ago,Edralyn ***********,SIR SANA PO MATANGGAL NA PO UNG ONE HEALTH PASS
17 weeks ago,MJ ***********,966 saudi code
17 weeks ago,Ina ***********,"Tibayan mo lang loob mo ate . Kung mabait naman amo . Swerte na kung hindi nanakit, maayos ang pasahod. May food and May rest. Sempre hindi mahigpit sa phone with machine libreng WiFi. Okay na yan . Labanan lang talaga ang homesick. Tibayan ang loob."
17 weeks ago,FvoxWheng ***********,Gud evening po sir arnel tnung ko lng po ofw po ako at kbblik ko lng ulit d2 s Singapore for 2yrs contract if ever po mtpos ako d2 at uuwi nako for good merun po bko mkkuha s owwa or any jobs or pnimula PNG hanapbuhay pra dnko ulit llayu s pmilia ko
17 weeks ago,Merfe ***********,Watching from Cyprus.
17 weeks ago,Miss ***********,watching from
17 weeks ago,Joey ***********,"Sa mga oras sir ng pag activate o pag fill up ng mga datos, ng 24 oras lamang hindi po sapat dapat pini fill up yun ng with in 3 days.."
17 weeks ago,Joan ***********,Sir good pm po
17 weeks ago,Doble ***********,Boss pwde patulong nman po kasi yung isang kasama namin dto sa jeddah saudi Arabia ay na stroke at dina po makagalaw sana po matulugan natin sya makauwi sa kanila sa pinas kasi wlang nagaalaga sa kanya lahat po kasi may trabaho din po..pasinsya na hope po sa tulong nyo...
17 weeks ago,Serrano ***********,Sir repatriation po
17 weeks ago,Pearly ***********,From dubai
17 weeks ago,Gal ***********,"Watching from UAE
."
17 weeks ago,Emma ***********,watching from italy..di marinig audio
17 weeks ago,μαρψυ ***********,Watching po ng Greece
17 weeks ago,Miss ***********,mhirap po kmuha ng health past sir
17 weeks ago,James ***********,mag 6 months napo kami dito sir sana maka uwi po kami
17 weeks ago,Monge ***********,No sound po
17 weeks ago,ذطهثشفء ***********,Region 6 po
17 weeks ago,James ***********,helo sir tulungan niyo po kaming maka uwi
17 weeks ago,Lido ***********,Sir mahina po ung sound u
17 weeks ago,Crismhel ***********,Hello po sir
17 weeks ago,Grace ***********,Watching from dubai po
17 weeks ago,Babell ***********,one health pass mahirap po lalo sa kasambahay
17 weeks ago,Karen ***********,"Good evening sir Arnel mabuhay po. Concern ko lng po sana don sa scholarship ng ofw dependents, ang need po kc dapat ang sahod ay ung mas mababa sa 30k , kung umabot po ng 35k pataas hindi na po pede makakuha ng scholarship and dependent? . Fr. Taiwan po thanks"
17 weeks ago,Márcèlò ***********,Sna po mtugunan nyo ang hinaing q
17 weeks ago,Josephine ***********,Sir sana po alisin na 1health pass
17 weeks ago,Leizel ***********,Nag iico po boses nyo po
17 weeks ago,Wendy ***********,ang hina po
17 weeks ago,Merlinda ***********,Kailan po kmi puwede mka avail ng DOLE AKAP SIR
17 weeks ago,Rosalie ***********,Helo po sir arnel watching from Kuwait po may kaibigan po ako dto Kuwait tpus na po conratah nya nog Decber 1 2021 pa ayw po siya pa uwi amo po niya siya po si marisa linao sana po matulogan u po siya mka uwi po pls po name mariza linao address sanlonardo nueva ecija po
17 weeks ago,Inda ***********,Good eve sir
17 weeks ago,Shibayshan ***********,Remove one Health pass PASAKIT SAMING mga ofw
17 weeks ago,Ben ***********,"Kadalasan ang may pakana ng pag tourist visa ng mga kababayan natin ay mismong kamag-anak din nila, dahil sila ang nagtuturo kung paano pupunta sa isang lugar na wala namang alam kung paano pumunta sa isang bansa. Tapos kapag may problema na.."
17 weeks ago,Mon ***********,Sa totoo lang ang hirap sa atin ay pasahan lalo na sa OHP na yan sbi sa Ittf pag tawag mo kay Atty. Cacdac pag na kausap mo nman iba nman ung proseso hindi natin kung cno ang may desisyon na alisin na yan sobrang perwisyo kaya umaksyon kau wag puro publicity tnx
17 weeks ago,Miss ***********,may echo po
17 weeks ago,Nicolas ***********,Hello good evening pa shout shout ofw from Jordan sir god bles stay safe and healthy sir
17 weeks ago,Elizabeth ***********,"Congrats
po sir, watching from UAE - sir please tulungan nyo po aqo dto UAE gusto kona sna mkauwe jn Pinas kc my sakit po aqo pro dpo aqo pyagan ng agency qo ptuloy prin aqo ibenta s ibng mga amo kht my nrramdman pkong sakit
sir Arnel Ignacio, agency kopo tarabot tabbeer dto UAE"
17 weeks ago,Maricel ***********,No sound po
17 weeks ago,Joan ***********,Dole tabang po sir
17 weeks ago,犠打 ***********,Hello po sir magandang gabi po
17 weeks ago,Ykcor ***********,Mahina po sound sir
17 weeks ago,Estela ***********,Sir pwede po bait tulungan nin
17 weeks ago,EdMrn ***********,"Congrats
sir"
17 weeks ago,كثث ***********,KAYLAN PO MABIBIGAY ANG DOLE AKAP PO
17 weeks ago,Turoy ***********,"Hina po sound ,"
17 weeks ago,Maria ***********,kpag gusto nyo pohagabroad dpat poh buo poh loob mo
17 weeks ago,C.K. ***********,boss suggest lng baka pede gawin nlng na katulad dito sa uae na resident id lng ang gamit sa lahat ng sangay ng goverment.para ndi na tulad ng paguuwi ka need mo pa ng maraming papel ..kung mgkukuha ng oec .. iiscan nlng un national id ..then tpos na
17 weeks ago,Honey ***********,Good evening po sir Arnel! From UAE. Ka gagaling ko lang po bakasyon sa pinas. Pahirapan po kumuha ng OEC dun kailangan pa ng notary at ang mahal ng notary nila yung insurance fee aside from pag ibig na babayaran bago ka mkakuha ng OEC. Ang daming babayaran na requirements to get OEC in the Phil's. Sobrang pahirap ng mga OFW at di rin naman namin magagamit dahil may expiration po. Uuiwi nlang kami sa bansa natin at masaya kaming makauwi kaso pahirapan sa mga requirements. Ok lang naman po my OEC pero sana passport at visa lang ang requirements sapat na. Maraming salamat po. More power and God bless....
17 weeks ago,Bacoludan ***********,Hello po sir
17 weeks ago,Elma ***********,Sir mahina po saund nyo
17 weeks ago,Jhijie ***********,Mahina Po yong audio ninyo sir
17 weeks ago,Viki ***********,THANK U PO SA TULONG NYO SA KAPATID NI JONNA MATELA
17 weeks ago,Merfe ***********,Mhina po sound
17 weeks ago,Lic ***********,Sir. Sana po tanggalin na ang ONE HEALTH PASS.
17 weeks ago,Miss ***********,sir Arnel my echo po
17 weeks ago,Ai ***********,UAE
17 weeks ago,Maricel ***********,Hirap po ma avail ng program sir
17 weeks ago,Azeil ***********,"Sir arnel Dh po aq sa saudi na kakaexit lang po last dec, 5years n po aq sa employer q kaso nagexit po aq, gusto q po sana mkabalik ulit sa previous na employer q. Ang kaso nakabanned pa po ang dh sa saudi, possible po ba na mkaapply apply ulit at mkabalik s amo q ulit?"
17 weeks ago,Jack ***********,Ang hina mg bosis
17 weeks ago,Nette ***********,OEC at One Health Pass...paki alis po
17 weeks ago,Russell ***********,ANO PO MGA PEDENG CONTACT NUMBERS
17 weeks ago,Vilma ***********,my dental din po sir sa ofw hospital
17 weeks ago,Vicky ***********,Alisin po One health pass
17 weeks ago,Precy ***********,Buti nag live kyo
17 weeks ago,Iris ***********,Hi sir di po kau marinig mahina
17 weeks ago,Ako ***********,Health pass po nagpapahirap ng ofw
17 weeks ago,Rham ***********,hello po sir arnel...Tanong lang po Sana ako kung kelan talaga Ang open Ng scholarship program caraga region po ako sir makadalawang beses na po ung anak ko nag follow up dun nung unang punta niya Sabi may mag start kaya nung bumalik na nman siya nung May Sabi na namn June po
17 weeks ago,Miss ***********,sir ng echo po kayo
17 weeks ago,Cristina ***********,Madali lang po ang One Health Pass
17 weeks ago,Anthony ***********,"sir yung sa asawa ko po nagfile sya sa owwa ng dole-akap sa region 12 po kami mahigit isang taon na hanggang ngayon palangi nalang sagot nila sa email wala pa daw pundo mafhintay lang daw,,,ano po dapat gawin bakit ganun wala ba talagang pundo yan,,,saĺamat"
17 weeks ago,Rose ***********,Ok na sir loud and clear na po boses
17 weeks ago,Cris ***********,Sir arnel pakitulungan Yong kapitbahay ko dito sa Kuwait gusto na nya mkauwi. 4 yrs na sya ayaw siyang pauwiin. At nkaranas na daw xang mabugbog NG tatay NG amo nya. Nagmamakaawa po sya sa akin po na tulungan ko xa. *******.yan po number nya dito sa Kuwait .
17 weeks ago,James ***********,Sir arnil pake ingay nmn po sa bohol region hangan nagyon wla pa po kme natangap ng nuon bagyong oddette fenacial assetance lapit na mag isang taon. Nka pasa nmn po kme ng requirements syang nmn po ang ginasatos at pinasahe paponta sa lungsod nmin. Active members po ako sa owwa.
17 weeks ago,Catherine ***********,One health pass alisin n po..
17 weeks ago,Jesusa ***********,Good evening po sa lahat
17 weeks ago,Enojardo ***********,sir dapat tanggalin n yan one health pass ksi hirap kya mg regesterd total wla n pandemic gya dto s ibang bnsa fully vaccited d n kylngan one helth abala lang yan s amung ofw gya ko nkraan umuwi ako muntik hindi ako mkskay erolpano dhil s one helath pass ayaw s cpon ko mumurahin lang
17 weeks ago,Erika ***********,Watching from.
17 weeks ago,Rosalina ***********,Hello sir
17 weeks ago,Alma ***********,May echo yong sound mo sir
17 weeks ago,Merlinda ***********,Malakas n man po
17 weeks ago,Wendy ***********,sounds please
17 weeks ago,Lynn ***********,Congrats
17 weeks ago,Tessalonica ***********,Business po sana for good sana.
17 weeks ago,Mon ***********,Sana makipag tulungan Kau sa ittf na dpat alisin na ung OHP na yan kc ala nman ibinibigay na benifits sa mga ofw kungdi perwisyo at marami na kming nag dedemand pero ala lang at tama ung cnasabi ni Mr. Bong Cocha na ang ofw ay alang boses sa ating Pamahalaan tnx Sir God bless po
17 weeks ago,Marie ***********,"MADALI LANG PO KUMUHA NG ONE HEALTH PASS,BASTA HAWAK NYO PO TICKET NYO,PASSPORT AT VACCINE CERTIFICATE."
17 weeks ago,Wilyn ***********,Hello po Sir Gandang Gabi po!From hk
17 weeks ago,Jundo ***********,Sir wala in mo ang one health pass...
17 weeks ago,Daffodile ***********,sir nasa cdo n po ako
17 weeks ago,Bella ***********,Mahina po sounds sir
17 weeks ago,Anna ***********,Gud evening po..sir arniel may tanong po ako.. work po ako dito sa kuwait mula 2010 hanggang 2022..dati kon amo magulang... amo ko ngaun anak na ito...incase uuwi ako ng pinas....may makuha ako separation pay sa amo ko..same family parin sila.....mula2010 /2022 dpa nka-uwi ng pinas...
17 weeks ago,Nhoy ***********,sir arnel patulong po kmi mga EPS sincere worker ng korea na mga na cancel ang mga contrata dahil sa pandemic higit 2 yrs na po kmi d nakakabalik sa trabaho kaya na cancel ung mga contrata
17 weeks ago,Marie ***********,Madali naman po kumuha ng ONE HEALTH PASS
17 weeks ago,Bheth ***********,No sound
17 weeks ago,En ***********,Mahina po boSes nyo sir arnel
17 weeks ago,Jenny ***********,"Congrats
po"
17 weeks ago,Min ***********,dole akap 2021 pa po till now wala parin
17 weeks ago,Mashella ***********,Hello po
17 weeks ago,Vilma ***********,Opo ok n po
17 weeks ago,Derick ***********,nag EECHO po nagfeedback
17 weeks ago,Rosalinda ***********,Mahina po
17 weeks ago,Divina ***********,Mahina po
17 weeks ago,Beth ***********,Mahina po
17 weeks ago,Hao ***********,Dole akap 1 yr na po wala parin po
17 weeks ago,Monge ***********,Sa for good napo ano po bigay nnyo
17 weeks ago,Elvie ***********,Hi po
17 weeks ago,Barza ***********,Nag echo po
17 weeks ago,Tongsam ***********,sir arnel pansinin ninyo po kami dito
17 weeks ago,Alejandra ***********,Scholarship po sana please
17 weeks ago,Rom ***********,okay n po sir malakas na
17 weeks ago,Cel ***********,Paano po mag avail sa schoolarship
17 weeks ago,Ma ***********,Sir arnel napakahirap naman po mag online appointment sa owwa dubai.. Maliban po sa sobrang tag init ngayon dito sa uae..
17 weeks ago,Roda ***********,"OWWA Overseas Workers Welfare Administration ayusin nyo po ang online appointment system nyo, bakit palaging ""no available slot"" until 2023. Pwde ba mag walk-in sa OWWA Manila? Uwi po ako next month, limited time lang po pero hindi makapagpa appointment sa inyo."
17 weeks ago,Emely ***********,Gud eve po
17 weeks ago,Charl ***********,Watching uae
17 weeks ago,Starlet ***********,Alisin na ang health pass
17 weeks ago,Ellehcsirk ***********,Mahina po ang boses
17 weeks ago,Prosperity ***********,Dami requirements po hayst
17 weeks ago,Materese ***********,Sir alisn na po ang onehealth.pass
17 weeks ago,Jhoanna ***********,"Magandang Araw po sainyo sir Arnel. Sana ay matulungan niyo po ako. Ako po ay isang baguhan lang po dito sa ksa. Isa po akong cleaner mag aanim na buwan na po ako dito. Ang saklap lang po ng pakikipagsapalaran ko dito kasi hindi po kami maasikaso ng maayos ng agency namin. Wala pong pasahod na maayos. Pero araw2 po kaming pumapasok. Sana maintindihan niyo po ang sitwasyon po namin, marami po umaasa sa amin sa pilipinas halos tatlong buwan na po kaming walang sahod. Sobrang nakakalungkot po. Sa AFRAS COMPANY po ako. Tawagan niyo po ako sa number ko *******. Nagbabakasakali lang po na mapansin niyo po ako. Salamat po. God bless."
17 weeks ago,Cel ***********,Mahina pa po
17 weeks ago,Rose ***********,Sir Baka po pwedeng tanggalin na po yung mandatory na insurance na dapat kunin Ng isang ofw balik manggagawa bago po makakuha Ng OEC sa POEA dahil may OWWA MEMBERSHIP nman na po kami at may PHIL HEALTH din po ... magbakasyon lng po konti LNG po Pera maiuwi makasama at Makita LNG po ang family
17 weeks ago,Rose ***********,Sir mahina po ang boses
17 weeks ago,Jlynne ***********,Magandang gabi sir arnel
17 weeks ago,Ha ***********,mamaya sir 31M NA po yan
17 weeks ago,Mech ***********,Ito po ung # *******
17 weeks ago,Merlinda ***********,Mahirap ang mag register po
17 weeks ago,Yoo ***********,"Hello po Sir,sana po ma actionan yong kaso namin dito,ngayon po nasa BK po kami sa riyadh nakatira,mag 6 months napo kami dito lima po kami na pinalayas sa agency namin dito sa riyadh po,ngayon po, di po tumutulong yong agency namin sa pinas na makauwi kami,sana po mabasa po niyo po yong hinaiang namin dito."
17 weeks ago,Ana ***********,Sir salamt po S pgtulong s mga ofw
17 weeks ago,Anne ***********,Gandang gabi po sir Arnel
17 weeks ago,Roda ***********,"Ang online appointment nyo dyan sa pinas bakit palaging ""no available slot"" until 2023 last year pa ako nag ttry mahpa appointment."
17 weeks ago,Pauline ***********,Mahina po audio
17 weeks ago,Tongsam ***********,sir mapansin nyo kmi sana
17 weeks ago,AL ***********,ang hina po ng audio sir arnel
17 weeks ago,Roselyn ***********,Gud eve po
17 weeks ago,Mitch ***********,Hello po from Kuwait po sir
17 weeks ago,Nicole ***********,Sir yung Dole akap namin sa Region 8 di pa nabibigay last April sabi samin di nila ma release dahil sa election Ban pero ngaun on process na naman. Hindi na din nagrereply ang Owwa at Dole araw araw kami tumatawag walang sumasagot.
17 weeks ago,Erlin ***********,Hi sir Arnel
17 weeks ago,Jeric ***********,Mahina po sounds
17 weeks ago,Imee ***********,Ang hina po ng sound
17 weeks ago,J ***********,Nahihirapan kmi sa OHP po
17 weeks ago,Liezl ***********,Panu po kumuha ng scholarship
17 weeks ago,Jazyn ***********,sir sana naman alisin nyo na one health pass
17 weeks ago,كثث ***********,sir arnel .anu na po balita sa dole akap po
17 weeks ago,Joan ***********,One health pass po alisin na.
17 weeks ago,Estela ***********,Sir
17 weeks ago,Rosalie ***********,Helo po sir arnel hihigi ko po sana tulog si marisa linao dto po siya sa kuwait tpus na conratah po niya nog Decber 1 po ayw po siya pa uwin ng amo nya po
17 weeks ago,Miss ***********,sir scholarship sa college sir need ng mga ofw
17 weeks ago,Derick ***********,nag eecho k u sir arnel mahirap maintindihan
17 weeks ago,Mary ***********,Mahina po
17 weeks ago,Jhay ***********,Oec po pano po kumuha
17 weeks ago,Dame ***********,sir bakit pahirapan makakuha scholarship
17 weeks ago,Mj ***********,Mahina Po ung sounds
17 weeks ago,Mary ***********,Malalim po boses
17 weeks ago,Dhel ***********,LEBANON here
17 weeks ago,Teng ***********,wala pong audio sir
17 weeks ago,Balmond ***********,DOLE AKAP PO PARELEASE NA REGION4A
17 weeks ago,Vivian ***********,Hello po
17 weeks ago,Tatiana ***********,Walang sounds
17 weeks ago,尔 ***********,Alisin npo sana onehealth pass
17 weeks ago,Nhildz ***********,Update po sa TULONG PUSO
17 weeks ago,Marie ***********,Mahina po
17 weeks ago,Jelly ***********,#POLODUBAI mga taga UAE speak up
17 weeks ago,Ayallap ***********,Sir pls alisin na ninyo Ang One health Pass
17 weeks ago,Viki ***********,SANA PO MATULUNGAN NYO SIR NNJAN PO CONTACT NO.NYA
17 weeks ago,John ***********,BPBH follow up po
17 weeks ago,Deloyola ***********,step 2 and 3 ang nagpahirap sir
17 weeks ago,Algea ***********,Mahina ang sound sir
17 weeks ago,Ashley ***********,Helo po sa lahat
17 weeks ago,Raquel ***********,*Alisin n Po ang OEC Namin..
17 weeks ago,Leira ***********,"Hello sir arnel,,mahina po audio"
17 weeks ago,Serrano ***********,May vaccine na po oka na po yun
17 weeks ago,Jean ***********,Hello po
17 weeks ago,John ***********,Salamat po
17 weeks ago,Cathy ***********,"Hi po , congratz po"
17 weeks ago,Jasmin ***********,Ok n po
17 weeks ago,Mae ***********,Mabuhay po kayo sir arnel
17 weeks ago,James ***********,nasa riyadh po ako.. at nakatira sa polo shelter po
17 weeks ago,Viki ***********,Hello po
17 weeks ago,Trixy ***********,Hirap daw mag apply mga OFW sa NHA..
17 weeks ago,Liezel ***********,Pansinin niyo po ang OEC issue
17 weeks ago,Berly ***********,Mahina pa din po
17 weeks ago,Elvira ***********,Sir pwede po ba Maka utang puhunan.
17 weeks ago,Mary ***********,Malayo po
17 weeks ago,Daffodile ***********,hello po
17 weeks ago,Presilda ***********,Yan malakas na sound po
17 weeks ago,真珠モンテマヨール ***********,Nku po sir region 8 dedma ma lang sila
17 weeks ago,Arrabella ***********,ang pag aabroad dapat buo ang loob
17 weeks ago,Memz ***********,Sir pano magapply ng ofw loan po..
17 weeks ago,Hermogenes ***********,Dole-akap for Distressed OFW .. Lalo na sa Region 4a.. Since last year hindi pa na re release and mga approve. While yung ibang region is nag release na po.. Pakikalampag lang po ang Owwa /Dole Region 4a at sila lang po ang hindi nakakapag release .. Salamat.
17 weeks ago,Rachel ***********,mahina pa din po
17 weeks ago,Joel ***********,Hello po .may ofw loan ba sa owwa.
17 weeks ago,Jep ***********,Love2
17 weeks ago,Datu ***********,Mhina po voice nyo
17 weeks ago,Merlinda ***********,Mahirap po ang pag registered lalo n pag walang internet
17 weeks ago,Jo ***********,"Sir ask lang po,yung indemnity po ba kailan pa po yung sinabatas,kasi po ini-open konpo sa amo ko tapos sabi niya wala daw siya alam dyan,ang alam lang niya ay yung kompanya.. Sabi ko po meron din ying mga kasambahay,wala daw yun sa contract... Paano po yun sir"
17 weeks ago,Erlinda ***********,Hello po
17 weeks ago,Azelleb ***********,Ano po ba Yong scholarship
17 weeks ago,Yenruj ***********,Sir wla voice
17 weeks ago,Najeeb ***********,Barag po my ibang sounds
17 weeks ago,Joddan ***********,Paano po mag load sa Owwa sir??
17 weeks ago,John ***********,Bpbh po D.A. salamat po sa tulong
17 weeks ago,Eds ***********,sir baka po matutulungan nyo ako makauwe
17 weeks ago,Ritchelle ***********,Hina po ng mga boses niyo po
17 weeks ago,Lesty ***********,Agaran po ako
17 weeks ago,Tatiana ***********,Walang boses po
17 weeks ago,Janken ***********,Hello po sir arnel mabuhay po kau
17 weeks ago,Renzo ***********,Sana po ulit ang OWWA secretary sir
17 weeks ago,Jasmin ***********,Paanu po mka avail ng scholarship
17 weeks ago,Maria ***********,tyagaan mo nlng poh andto ka na poh ehh
17 weeks ago,Rom ***********,meron po ba kayong mga programs for seafarers?
17 weeks ago,Arlene ***********,my echo boses mo sir
17 weeks ago,Charivic ***********,Ofw from hongkong po
17 weeks ago,Arlene ***********,meron po sir
17 weeks ago,J ***********,Bka po pwede mkaalis ang OHP
17 weeks ago,Lota ***********,uuwi na nga lang dami pa pahirap sa ofw
17 weeks ago,Juvy ***********,Mahina po
17 weeks ago,Lani ***********,Oo nga po
17 weeks ago,Fritziejill ***********,Ok po narinig kayo
17 weeks ago,J ***********,Sir Tawagan nyo po ako
17 weeks ago,Presilda ***********,Remove One Health Pass
17 weeks ago,Estela ***********,Parang awa ninyo po
17 weeks ago,Lourdes ***********,Mahina po audio
17 weeks ago,Liezel ***********,Specific concern ng ofw
17 weeks ago,Shine ***********,hello po
17 weeks ago,Mc ***********,Asan na po akap region 4a
17 weeks ago,Doris ***********,Mahina po
17 weeks ago,Ellis ***********,"Good day Sir, please masyado hirap Ang OHP,"
17 weeks ago,Marie ***********,Okay na po naririnig na
17 weeks ago,Ellise ***********,Pano po mag apply ng scholarships
17 weeks ago,Aries ***********,sir help nman po un pg kuha ng OEC dpt kht wla appointment accommodate nman
15 weeks ago,Maria ***********,Hello po
17 weeks ago,Carmen ***********,Tanggalin napo yung One Health Pass
17 weeks ago,Pentecostes ***********,Congrats
17 weeks ago,Pentecostes ***********,Hello po sir
17 weeks ago,Cva ***********,My email po kadellac10@gmail.com po
